616857-616848-63550002,Femminile,,20,Secondarie Superiori,Studentessa universitaria ,Modena ,Modena ,20 anni ,Sí,Modena- Bologna ,Italiano ,Italiano dalla famiglia ,Inglese e francese a scuola ,Italiano ,Molto bene,Modenese ,Bene,Modenese ,,"Sí,M,F",,"No,M,F",,No,,"Sí,M,F",,"No,F",,"Sí,M,F",,No,,"Sí,M",,"No,M,F",,Altro,,"Sí,M,F",,Altro,,"Sí,F",,,,,Sí,,Sí,,Sí,,Sí,,Sí,,No,,No,,No,,,,,Sí,,Sí,,No,,Sí,,Sí,,Sí,,No,,Sí,,Sí,,Sí,,Sí,,Sí,,No,,,,50/50,,Spesso,,Mai,,,Sí,Modenese ,,Sí,No,,Sí,No,,No,No,,No,No,,Sí,No,,No,No,,Sí,Sí,,No,No,,Sí,No,,Sí,No,,Sí,No,Instagram ,,,,,Ogni anno,,Mai,,Ogni anno,,"Si mi piace, è parte della mia tradizione ","Parlerei italiano e inglese, insegnerei anche il modenese ","Si, mantenere le tradizioni è importante ","Parlarlo di più anche nelle scuole e in giro, tutti dai più anziani ai più giovani ",Si dovrebbe usare sempre in qualunque contesto ,"Studiato come materia no, ma bisognerebbe parlarlo ",Tutte le varietà di Emiliano a seconda del luogo dove ci si trova ,"No, bisogna usare l’italiano come lingua d’istruzione. Non sarebbe giusto per tutti insegnare il dialetto ",,Ho sempre ritenuto la conoscenza di più lingue e dialetto molto importante e utile ,Modenese o italiana ,Vivere in montagna ,Vivere in pianura/città ,,4,4,3,4,4,5,4,5,Al lèt,,,,,,,
616857-616848-63549744,Femminile,,21,Secondarie Superiori,Impiegata ,Modena,Modena,Da sempre ,No,,"Italiano, dialetto modenese",Italiano da madre padre  ,Dialetto modenese da nonni,Italiano,Molto bene,Dialetto modenese ,Bene,Dialetto modenese ,,"Sí,M,F",,"Sí,M,Altro",,"No,M,F",,No,,No,,No,,No,,"Sí,M",,"Sí,M,F",,"Sí,M,F",,"Sí,M,F",,No,,No,,No,,,No,,No,,No,,No,,No,,Sí,,No,,No,,No,,,Sí,,No,,No,,No,,No,,Sí,,No,,Sí,,No,,No,,Sí,,No,,No,,No,,Molto spesso,,Molto spesso,,50/50,,,Sí,Dialetto modenese ,,Sí,No,,No,No,,No,No,,No,No,,No,No,,No,No,,Sí,Sí,,No,No,,No,No,,Sí,Sí,,No,No,,No,No,,,Mai,,Mai,,Mai,,Si mi piace,Italiano ,"Si mi piacerebbe si mantenesse nel tempo, mi ricorda i miei nonni",Non lo so,"Tra amici, qualche battuta, o esclamazione ",No,No,No,Non so,Non lo so,Italiana e emiliana Modenese ,Vivere in luoghi sperduti ed essere un po' grezzi,Vivere in pianura,,3,3,3,5,4,4,3,5,Al lét,Al sol ,Basléna,An se menga dé,Glieni arivé di mondi student iér,Al rosc lé ad fianc a la porta ,An ghe piò la mastelà in vettà la tevla,Al ma sgrafigne al gàt  Al ma sgrafigne la gata
616857-616848-63550201,Maschile,,21,Secondarie Superiori,Studente,Modena ,Modena ,Da sempre ,Sí,Modena - Ravenna ,Italiano ,Italiano ,"Inglese, scuola ",Italiano ,Un po',Modenese ,Un po',Modenese ,,No,,Sí,,No,,Sí,,No,,No,,No,,No,,Sí,,No,,No,,No,,No,,No,,,Sí,,No,,No,,No,,No,,No,,No,,No,,No,,,Sí,,No,,No,,No,,No,,No,,No,,Sí,,No,,No,,Sí,,No,,No,,,,Mai,,Spesso,Al tal degh,Alle volte,Inglese ,Vegan ,No,Modena ,,,,,,,,,,,,,,,,,,,,,,,,,,,,,,,,,,,,,,,Mai,,Mai,,Mai,,Mi piacerebbe conoscerlo meglio perché è la lingua dei miei nonni e della mia terra,Italiano e gli insegnerei il dialetto ,Assolutamente si. È una tradizione della città ,Insegnarlo a scuola come un gioco da insegnanti o nonni,"Per rievocazioni storiche, carnevale, feste ",Alle elementari per farlo conoscere ai più piccoli ,"Modenese, perché Modena è la mia città ","No, va lasciato l'italiano ",Modenese ,"Si, se lo sapessi lo insegnerei a mio figlio ","Modenese, Italiano, europeo ",Saper vivere con la natura ,Essere a contratto con ka storia della città ,,1,2,2,1,1,1,1,1,,,,,,,,
616857-616848-63550474,Femminile,,23,Secondarie Superiori,Disoccupata,Modena,Modena,23,No,,Italiano,Italiano,"Francese, inglese dalla scuola ",Italiano,Molto bene,,Molto bene,,,"Sí,M,F",,"Sí,M,F",,Altro,,"Sí,M,F",,"No,Altro",,No,,No,,"Sí,M",,"Sí,M,F",,"Sí,M,F",,"Sí,M,F",,Altro,,Altro,,Altro,,,Sí,,Sí,,Sí,,Sí,,No,,Sí,,No,,No,,No,,,Sí,,No,,Sí,,Sí,,Sí,,Sí,,Sí,,Sí,,Sí,,Sí,,Sí,,No,,No,,No,,50/50,,Alle volte,,50/50,,,Sí,,,No,No,,No,No,,No,No,,Sí,No,,No,No,,No,No,,Sí,Sí,,No,No,,Sí,Sí,,Sí,Sí,,No,No,,No,No,,,Mai,,Mai,,Mai,,"Si, è la mia lingua ",Parlerei in italiano e raramente in dialetto,"Si, è comunque parte del nostro paese ",Parlarlo,Solo in rapporti confidenziali e d'amicizia ,"No, non c'è bisogno di studiarlo ",Dialetto ,No,,Non saprei ,Italiana,Abitare in montagna ,Stare in pianura ,,1,1,1,1,1,1,1,1,,,,,,,,
616857-616848-63550555,Femminile,,40,Secondarie Superiori,Responsabile amministrativa ,Modena ,Campogalliano ,27 anni,No,Campogalliano-modena,",inglese,tedesco",Nessuno,Scuola,Italiana,Bene,Modenese/ferrarese,50/50,Modenese/ferrarese,,Sí,,Sí,,Sí,,,,,,,,,,Sí,,,,Sí,,,,,,,,,,,,,,,,,,,,,,,,,,,Sí,,,Sí,,,,,,,,,,Sí,,,,Sí,,Sí,,Sí,,Sí,,,,,,,,Spesso,,Alle volte,,Alle volte,"Tedesco,inglese ",,Sí,,,,,,,,,,,,,,,,,,,,,Sí,,,Sí,,,Sí,,,Sí,,,Sí,,,,,,,Mai,,Mai,,Mai,,"Si, è la.ia tradizione anche se purtroppo non lo si benissimo",Parlucchiamo in tutte,"Si, è la nostra cultura originaria, e va portata avanti come tutte le tradizioni","Promuoverlo grazie agli anziani, si sta perdendo e solo loro ad oggi lo sanno parlare perfettamente","Ovvio non quando si studiano certe materie e non al lavoro, per il resto  via libera ","Alle elementari e medie si ,per portare avanti le nostre tradizioni",Tutte nelle rispettive città ,"No, li serve l italiano corretto e ancora non sappiamo neanche quello",Tutte a seconda della città ,"No per questo, am perché sappiano,compresa la lingua, la cultura della loro città di origine e magari anche dei genitori","Italiano,modenese",Dalle colline modenesi in su ,Pianeggiante non ne ho idea ,,3,3,3,1,3,3,3,1,Al let,Sol,,A sle nianch acort,L' è arrivè na carovana ad student,Al rusc l è lì atac la porta,Angson piò  i bazineli d'na volta,Al gat ma sgrafignè. La gata ma sgrafignè
616857-616848-63550031,Maschile,,38,Migistrale e oltre,Sales Director ,Modena,Modena ,38,Sí,Bologna ,"Italiano, dialetto modenese",Italiano da genitori,Dialetto da nonni,Italiano ,Molto bene,"Modenese, reggiano, bolognese",Bene,Modenese ,,"Sí,M,F",,"Sí,M",,"Sí,M,F",,No,,No,,No,,No,,No,,No,,"Sí,M,F",,No,,No,,No,,No,,,No,,Sí,,No,,No,,No,,Sí,,No,,No,,Sí,Casa,,Sí,,No,,No,,No,,Sí,,No,,Sí,,No,,Sí,,Sí,,Sí,,No,,No,,No,,Alle volte,,Alle volte,,Alle volte,Inglese,,No,,,,,,,,,,,,,,,,,,,,,,,,,,,,,,,,,,,,,,,,,,,,,,Si perché mi ricorda le mie origini di cui sono orgoglioso ,Italiano e dialetto ,Si perché fa parte della nostra cultura ,Insegnarlo a scuola e corsi per adulti ,Ambienti informali ,Si,Locale ,No,,Ho già detto che lo vorrei a scuola ,Modenese,"Poco elegante, semplice, introverso, gran bevitore",Fighetto,,3,3,3,1,1,3,4,1,Al lét,Al sól,Al meint,I n’sín gnanc adé,In arivé tant studeint aiér,Al rosc l’è svein a la porta,Al masteli a ien piò in sema a la tevla,A m’ha grafiè al gat. A m’ha grafiè la gàta.
616857-616848-63551104,Femminile,,41,Migistrale e oltre,Impiegata ,Modena,Modena,41 anni,No,,Italiano,Italiano - famiglia,"Inglese, Spagnolo, formazione scolastica",Italiano,Molto bene,"Modenese, Reggiano, Bolognese",50/50,"Modenese, Reggiano, Bolognese",,"Sí,M,F",,"Sí,M,F",,"Sí,M,F",,"Sí,M,F",,No,,"Sí,M,F",,No,,"Sí,M",,"Sí,M,F",,"Sí,M,F",,"Sí,M,F",,"Sí,M",,No,,,,,Sí,,Sí,,Sí,Botteghe locali,Sí,,Sí,,Sí,,Sí,,No,,,,,Sí,,Sí,,Sí,,Sí,,Sí,,Sí,,Sí,,Sí,,Sí,,Sí,,Sí,,Sí,,No,,,,50/50,,50/50,,Alle volte,Inglese,,Sí,Modenese,,Sí,No,,Sí,No,,Sí,No,,Sí,No,,Sí,No,,Sí,No,,Sí,Sí,,Sí,No,,Sí,Sí,,Sí,Sí,,Sí,Sí,,,,,,Mai,,Mai,,Ogni mese,,Sì.  Radici culturali e ricchezza linguistica,Tutte quelle che conosco. Sono ricchezza culturale,"Si.  Storia, tradizione.  È un peccato perdere un linguaggio",Utilizzarlo in famiglia,"Contesti informali, nei contesti formali è importante che tutti possano comprendere",Come corso facoltativo,Ogni provincia dovrebbe mantenere viva la sua varietà,No.  Occorre una lingua nazionale,No,Lo consideravo importante a prescindere,Modenese,Essere cresciuto in appennino,"Essere cresciuti in città.   Esiste poi la differenza fra pianzan e ""ed la basa"" ( territori più a nord della provincia al confine col mantovano)",,3,3,3,1,3,3,3,1,Al lèt,Al sol,La besla,In sun gnanc acort,/,Al rosc l'è asvein al os,/,Al gat al m'ha sgrafgne
616857-616848-63551502,Maschile,,43,Secondarie Superiori,Impiegato ,Carpi ,Soliera,Sempre ,No,,Italiano  Dialetto ,Dialetto (nonni di madre)  Italiano (genitori) ,Inglese  Francese  Spagnolo ,Italiano ,Molto bene,Tutti ,Molto bene,Carpigiano,,Sí,,Sí,,Sí,,Sí,,No,,F,,F,,Sí,,Sí,,Sí,,Sí,,No,,No,,No,,,Sí,,Sí,,No,,No,,No,,Sí,,No,,No,,No,,,Sí,,Sí,,Sí,,Sí,,Sí,,Sí,,Sí,,Sí,,Sí,,Sí,,Sí,,No,,No,,No,,Alle volte,Quando non esistono parole dialettali adatte ,Alle volte,,Spesso,Le parole inglesi oramai fanno parte del parlato quotidiano ,,No,,,,,,,,,,,,,,,,,,,,,,,,,,,,,,,,,,,,,,,,Ogni anno,,Ogni anno,,Ogni anno,,Si perché penso che sia una lingua da tramandare alle future generazioni ,Italiano e Dialetto ,Credo che sia un modo per ricordarci da dove veniamo ,"Corsi di studio serali, rappresentazioni teatrali in dialetto ",Si dovrebbe usare tra conoscenti ,Perché no ,Modenese o carpigiano ,No ,,Sicuramente aiuta a capire meglio lo stato d'animo di come una persona si esprime ,Tutto ,Provenire dai monti ,Provenire dalla bassa o pianura ,,5,5,5,5,5,5,4,5,Al leet ,Al sol ,Al meint ,In s'ngin gnanc adée,"Ier, in rivée dimondi studeint ",Al rusc l'é ed fianc a la porta ,An ghé più sòi in sima a la tèvla,Al gàt al m'à sgranfgné  La gàta la m'à sgranfgné
616857-616848-63551774,Maschile,,16,Secondarie Superiori,Studente ,Sassuolo,Maranello ,13 anni,No,,"Italiano, modenese, trentino ",Italiano genitori ,"Modenese e Trentino, nonni ",Italiano,Molto bene,Sassolese ,Bene,Sassolese ,,,,Sí,,,,Sí,,,,,,,,,,,,,,,,,,,,,,,,,,,,,Sí,,,,,,,,,,Sí,,,,,,,,,,,Sí,,Sí,,,,Sí,,Sí,,Sí,,Sí,,,,,,,,Alle volte,,Spesso,,Alle volte,"Trentino inglese, francese ",,Sí,Sassolese ,,,,,,,,,,,,,,,,,,,,Sí,,,,,,,,,Sí,,,,,,,,,,,,,,,,Sì,Italiano e modenese ,Perché come tutte le lingue regionali ha delle particolarità è serve a distinguere le provenienze ,"Cartelli stradali, dovrebbe essere meno stereotipizzato ",In tutte le occasioni apparte lavoro e scuola ,Sì perché presenta influssi da varie parti d’Europa ad esempio cavatappi si dice tirabusaun simile al francese e un modo per dire bere è Trinker in oltre presenta un fondo di celtico ,Bolognese e modenese ,Sì dovrebbe essere almeno un ora a settimana ,Modenese e bolognese ,Si ,Emiliano e italiano ,Non lo so ,Essere raffinato il giusto e godersi la vita ,,3,3,3,4,5,5,4,5,Al lêt ,Al soul ,La baslata ,I no se son menga acort ,I son ariveè daboun studeint a ier ,Al roasch l’è evsin a la porta ,No ghe son piò i paroel sò al tavol ,Al gat m’a grafiè   La gata m’a grafie 
616857-616848-63551896,Femminile,,20,Laurea Triennale,Studentessa,Pavullo (MO),Modena,20 anni,No,,Italiano,Italiano dai genitori ,"Inglese, tedesco e spagnolo tramite studi universitari",Italiano ,Un po',Modenese,Un po',Modenese,,"Sí,M",,No,,No,,No,,No,,No,,No,,No,,No,,No,,No,,No,,No,,No,,,,,,,,,,,,,,,,,,,,,,,,,,,,,,,,,,,,,,,,,,,,,,,,,,Mai,,50/50,"Veh, mica, Rusco...",Mai,,,No,,,,,,,,,,,,,,,,,,,,,,,,,,,,,,,,,,,,,,,,Mai,,Mai,,Mai,,"Si, per tenere vive le mie radici linguistiche ","Italiano, non parlo emiliano.",Si i dialetti sono comunque una parte culturale che sarebbe importante mantenere viva e riscoprire. ,"Magari corsi facoltativi a scuola o dovrebbe essere più sponsorizzato tra i giovani, ad esempio tramite i social.",In contesti familiari o tra amici.,Solo se facoltativo. Sarebbe bello avere l'opportunità di studiarlo ma non dovrebbe essere imposto a mio avviso.,Quella più comunemente parlata in Emilia ,"No credo che debba essere preservata la lingua nazionale a livello istituzionale, lo vedrei come una mossa troppo azzardata.",Modenese perché è la varietà che conosco.,Sicuramente la conoscenza di più lingue è un valore aggiunto importante.,Italiano.,Provenire dall'appennino tosco-emiliano.,Provenire dalla città/pianura.,,2,4,4,4,4,2,4,4,,,,,,,,
616857-616848-63552053,Maschile,,33,Secondarie Superiori,Tecnico it,Carpi,Carpi,33,No,,Italiano ,Italiano ,Italiano ,Italiano ,Molto bene,Carpigiano ,Bene,Carpigiano ,,"Sí,M,F",,"Sí,M,F",,No,,No,,No,,No,,No,,"Sí,F",,No,,"Sí,M",,"Sí,M,F",,No,,No,,No,,,Sí,,Sí,,Sí,Di zona ,No,,No,,Sí,,No,,No,,Sí,Sport ,,Sí,,Sí,,No,,No,,Sí,,Sí,,No,,Sí,,Sí,,Sí,,Sí,,No,,No,,No,,50/50,,Spesso,,Alle volte,,,No,,,,No,,,No,,,No,,,No,,,,,,,,,,,,,,,,,,,,,,,,,,,Mai,,Mai,,Mai,,"Mi piace, ci sono sempre meno emiliani in Emilia molti giovani emigrano. ",Italiano e dialetto ,È parte della nostra cultura ,"C'è poco da fare, l'Emilia è abitata sempre più da stranieri e meridionali e il dialetto si perderà. ",In contesti informali ,Penso che nessun dialetto debba essere studiato a scuola solo italiano e lingue straniere ,"Potendo scegliere dialetto Reggio, Modena e Bologna è similare ","No, ci vuole una lingua unica ","Carpigiano, perché è il mio... ","No, considero il dialetto una parte della cultura locale e tradizione. A un figlio insegnerei inglese o tedesco ",Emiliano,"Essere nato in appennino ed essere di visione limitata, così pensano i pianari dei montanari  Per me vuol dire nulla ","Essere un incapace buono a nulla, così pensano i montanari dei pianari  Per me vuol dire nulla ",,3,3,1,2,3,1,3,1,Al lét,Al sòl,Al méint,An sín gnànc acórt,In arivé dimàndi studeint a iér,Al rúsc l'è di fianc al ós,A ghín pió i catéin d'na vólta,A ma grafié al gàt  A ma grafié la gata
616857-616848-63552134,Maschile,,23,Laurea Triennale,Studentr,Correggio,Modena,23 anni,No,,Italiano,Italiano,"Inglese, francese. Scuola",Italiano,Bene,Modenese,50/50,Modenese,,"Sí,M,F",,"Sí,M,F",,No,,"Sí,M",,No,,"Sí,M",,No,,"Sí,F",,No,,No,,No,,No,,No,,No,,,Sí,,Sí,,No,,No,,Sí,,No,,No,,No,,No,,,Sí,,No,,Sí,,Sí,,Sí,,Sí,,No,,Sí,,Sí,,Sí,,Sí,,No,,No,,Sí,,Molto spesso,,Spesso,,Mai,,,No,,,,,,,,,,,,,,,,,,,,,,,,,,,,,,,,,,,,,,,,,,,,,,È adatto in alcune occasioni ad esprimere concetti non altrettanto chiari in italiano,"Italiano, inglese, poco emiliano","Si, è parte della nostra cultura. Così come la cucina e le usanze.","Scrivere dizionari, fare spettacoli e piccole opere teatrali. ",In contesti informali e quando si è certi che l'interlocutore comprenda,No. Intralcia il già claudicante apprendimento dell'italiano e dell'inglese. ,"I genitori in casa dovrebbero dire alcune frasi in dialetto, per non perdere la musicalità della lingua e le sue strutture base.",No. Vedi domanda 28.,,"L'emiliano, per quanto prezioso, non può sostituire l'apprendimento di lingue che aprono più possibilità, come l'inglese.",Emiliano,Proveniente dalla montagna,Proveniente dalla pianura,,4,3,3,1,2,2,4,2,Lèt,Al sol,Besla,I'ns sun gnanc acòrt,I en arivè dimandi student aìr,Al ròsc l'è a pres a l'os,In ghen piò i mastleini in vèta a la tevla,A m'a sgrafiè il gat
616857-616848-63552521,Maschile,,52,Migistrale e oltre,Dirigente in banca,Modena,Modena,Da sempre,No,,Italiano,Italiano,Inglese e tedesco studiandolo e vivendo all'estero. Mudnes girando tra le vie,"Italiano, raro il dialetto",Molto bene,Modenese,Bene,Modenese,,"Sí,M,F","La domanda è fuorviante. Almeno nel mio caso sarebbe con quale frequenza.e' segno di appartenenza x me e lo uso. Così lo sa anche mia figlia di 10 anni. Ma sono frasi fatte, espressioni, difficile x interi contesti.",Sí,,Sí,,Sí,,No,,Sí,,No,,Sí,,Sí,,Sí,,Sí,,No,,No,,No,,,Sí,,Sí,,Sí,"Pub di via Gallucci. Negozianti piccoli di zona, come il mio fornaio...",No,,No,,Sí,Occasionale. Per frasi fatte eimportante segno di empatia con molti clienti,No,,No,,No,,,Sí,,Sí,,Sí,,Sí,,Sí,Raro,Sí,Specie barzellette ef espressioni colorite,Sí,Se li prendiamo x i fondelli,Sí,,Sí,"Monolingua in questa caso. Era anche l'unica forma di esternazione in dialetto di mio padre, che x il resto come mia madre parlavano un alto italiano.",Sí,,Sí,,No,,No,,No,,Spesso,Per trovare termini che non so tradurre,Alle volte,Per colorire,Alle volte,Evito x snobbiamo l'inglese (che parlo) e piuttosto inserisco frasi in latino e tedesco,Taschengeld x paghetta anche con mia figlia. Anche in caso dai miei sopravvivevano una trentina di parole tedesche usate come lessico familiare.,Sí,Mudnes,,Sí,No,Consiglio: La Storia ed Modna acse' a la buona!,No,,,No,,,Sí,,,No,,,No,,,Sí,,Spesso con gli amici. Che battaglie col T9!!!,No,,,No,,Non lo uso,Sí,,,No,,,No,,,,Ogni anno,in piazza con Sandrone e da quel balcone tra i piccoli è apparsa anche mia figlia a fare anche lei il suo mono sproloquio!,Mai,,Mai,,Segno di territorio. Di lingua segreta. Di connivenza. Mi ha fatto fare affari e stringere amicizie,"Ho una figlia di 10 anni parliamo quasi sempre in italiano, ma anche dialetto. ",Territorio.,Tutti coralmente. Istituendo ricorrenze x esempio,X entrare in empatia. X colorite una frase. X dire magari sbagliando: anche io sono del clan.,Dubito. Ma ho visto le scuole ladine e ho visto i risultati. ,Essendo di Modena: il Modenese,Troppo tardi. Ora è l'italiano ad apparire logoro soppiantato da un elementare inglese. ,mudnes,Condivido. Con mia figlia parliamo tre lingue.,Modenese ed europeo,Orgoglioso del suo passato: scendiamo x padre da val Dragone!,Pianzan!!! Un centro urbano con una struttura anche dialettale più condivisa (sui monti ogni paesino aveva un'inflessione).,,3,4,3,4,3,4,3,5,Al let ,Al sol,Non lo so,In s'en gnanch adedi,I en arivedi soquant studeint aier,Al rosc l'è atacha a l'os,An-g sun pio' dal brochi su la tevla,Al m'ha grafie' al gat.   La m'ha grafigne' la gata
616857-616848-63553347,Maschile,,26,Secondarie Superiori,Libero professionista ,Correggio,Maranello,26,No,,Italiano e dialetto modenese,"Italiano, madre e padre",Inglese e francese presso scuole medie e superiori,Italiano,Molto bene,Modenese e reggiano,Molto bene,Modenese e reggiano,,"Sí,M,F",,"Sí,M",,"Sí,M,F",,"Sí,M",,"Sí,M,F",,No,,No,,"Sí,F",,"Sí,M,F",,"Sí,M,F",,"Sí,M,F",,No,,No,,No,,,Sí,,Sí,,Sí,Ogni tipo di esercizio commerciale ,Sí,,No,,Sí,,No,,No,,No,,,Sí,,No,,No,,Sí,,Sí,,Sí,,Sí,,Sí,,Sí,,No,,Sí,,No,,No,,No,,Alle volte,,50/50,,Alle volte,Inglese,Prestiti linguistici ,No,,,,,,,,,,,,,,,,,,,,,,,,,,,,,,,,,,,,,,,,Mai,,Ogni giorno,Radio locali,Mai,,"Mi piace, conferisce senso di appartenenza e la tradizione si rinnova ogni qual volta viene utilizzato","Sia in italiano che in dialetto emiliano, trovo giusto portare avanti la storia e le origini del nostro dialetto","Assolutamente SI. Perchè è fondamentale capire da dove si viene per sapere dove andare. Il dialetto è tradizione, storia, cultura del nostro territorio. È una lingua trasversale che unisce generazioni anche molto diverse, per età anagrafica, tra loro.","Dev’essere semplicemente tramandato è parlato in famiglia, io ho imparato così.","Non esistono un dove e un quando specifici, esiste di fatto un’atmosfera conviviale in grado di metterti a proprio agio parlandolo con chi ti sta intorno e ti capisce. Il dialetto viene spesso utilizzato per “fortificare” ulteriormente il significato di ciò che hai da dire.","No, basterebbe tramandarlo di padre in figlio e, soprattutto, di nonno in nipote.",Quello della tua provincia di appartenenza.,No,"Vanno bene tutte, non ho preferenze particolari. Io preferisco quello di Modena perché sono modenese","Non saprei, credo sia la lettura il miglior modo per migliorare la propria concentrazione, non saper parlare più lingue diverse","Prima EMILIANO, poi italiano",Grandi lavoratori e GRANDISSIMI BEVITORI,Avere dei vizi in più rispetto ai montróc!,,3,3,3,1,2,3,3,1,Lèt,Sól,"Non saprei, chiederò a mio nonno!",In gàn nianc fat al chès.,In arivè un sac ed studeint ìer,Al rosc lè ed fianc ala porta,Ag in menga pió dal bacinelì in sema a la tevla,"Non saprei, la completerei con molte parole italiane questa"
616857-616848-63554036,Femminile,,33,Secondarie Superiori,Dipendente pubblico ,Pavullo nel Frignano ,Pavullo nel Frignano ,33 anni ,Sí,72km ,Italiano ,Italiano ,Inglese io ,Italiano ,Molto bene,Modenese appenninico ,Molto bene,Modenese appenninico ,,"Sí,M,F",,"Sí,M,F",,"Sí,M,F",,No,,No,,No,,No,,No,,No,,No,,"Sí,M,F",,No,,No,,No,,,Sí,,Sí,,No,,No,,No,,No,,No,,No,,No,,,Sí,,No,,No,,No,,No,,Sí,,No,,Sí,,No,,No,,Sí,,No,,No,,No,,Alle volte,,Alle volte,,Spesso,Inglese ,Misunderstanding ,No,,,No,,,,,,,,,,,,,,,,,,,,,,,,,,,,,,,,,,,,,Mai,,Mai,,Mai,,"Si, ma ormai è in disuso tra i giovani. Rimangono gli anziani ",Italiano e inglese ,Si. È tradizione ,Bisognerebbe tenere incontri e organizzare seminari in dialetto ,Con gli anziani. Perché lo capiscono meglio ,No ,No ,No non é lingua colta ,Appenninico. È più bella e meno lamentosa ,Si ,Italiana di montagna ,"Avere un’identità genuina, essere leale. Avete altre priorità ",Essere più concentrati su tendenze e apparenza ,,3,2,2,1,1,1,4,1,Lèt,E sól ,E mènt ,,Son arivá tènt student a ier ,E rósc l’è vsin  a la porta ,Su la tavlá ang son piò al bacineli ,M’ha ruvinà al gát / la gàta 
616857-616848-63552812,Maschile,,31,Laurea Triennale,Consulente,Modena,San Cesario sul Panaro,31,No,,Italiano,Madre,Inglese a scuola,Italiano,Molto bene,Modenese,Molto bene,Modenese,,"Sí,M,F",,"Sí,M,F",,"Sí,M,F",,"Sí,M,F",,"No,M,F",,"Sí,M,F",,"No,M,F",,"Sí,F",,"Sí,M,F",,"Sí,M,F",,"Sí,M",,"Sí,M,F",,"No,F",,"Sí,M,F",,,Sí,,Sí,,No,,No,,No,,Sí,,Sí,,No,,No,,,Sí,,Sí,,No,,Sí,,Sí,,Sí,,No,,Sí,,Sí,,Sí,,Sí,,No,,No,,No,,Alle volte,,Molto spesso,,Alle volte,Inglese,,No,,,,,,,,,,,,,,,,,,,,,,,,,,,,,,,,,,,,,,,,Mai,,Mai,,Mai,,"Si, perché fa parte delle mie radici","Italiano e Emiliano, perché sono le uniche lingue che padroneggio","Si, perché è divertente sentirlo parlare",Promuovere eventi e spettacoli in dialetto,In tutti i momenti informali,Durante la scuola primaria sarebbe un'ottima attività culturale al pari dello studio delle culture extraeuropee,Modenese o Bolognese,"No, perché la lingua nazionale è l'italiano",,"Si, perché può facilitare l'apprendimento di altre lingue",Italiano,Nato in appennino,Nato vicino a Modena città,,2,2,3,1,3,3,4,1,Al lét,Al sól,Al mèint,An sein gánc acórt,I én arivè dimòndi studèint iera,Al ròsc l'è atés la pórta,An ghéin piò i paról in vattà a la tével,Al gat al mà gràfìè  La gatá la mà gràfiè
616857-616848-63553646,Femminile,,48,Secondarie Superiori,Imprenditore ,Reggio Emilia ,Modena ,48 anni ,No,,Italiano   Inglese   Francese ,Italiano da genitori e nonni,Inglese/francese scuola ,Italiano,Molto bene,modenese e reggiano,Bene,Modenese e reggiano,,Sí,,Sí,,No,,"Sí,F",,No,,No,,No,,"Sí,M",,No,,No,,"Sí,M,F",,No,,No,,,,,Sí,Se capita ,Sí,Se capita ,No,,No,,No,,Sí,Se capita ,No,,Sí,Se capita ,Sí,Ovunque se ho difronte un modenese ,,Sí,,No,,No,,No,,No,,Sí,,No,,Sí,,Sí,,Sí,,Sí,,No,,No,,,,Alle volte,,Alle volte,,Alle volte,Francese ,,No,,,,,,,,,,,,,,,,,,,,,Sí,Sí,,No,No,,Sí,Sí,,Sí,Sí,,,,,,,,,Mai,,Mai,,,,"Mi piace parlare Emiliano , mi fa sentire lappartenza al mio territorio. ",Italiano e Emiliano ,Si perché è bellissimo,Purtroppo può essere tramandato solo tra le generazioni ,In un contesto conviviale ,Non credo ,Modenese e reggiano ,No,,Sono d’accordo ,Mondo ,È una persona che è nata e cresciuta in montagna da genitori di montagna ,Una persona nata e cresciuta in città da genitori di pianura ,,3,3,3,1,3,3,3,1,Al let ,Al sol ,La basleta ,In sin gnanc sde ,In arrive’ dimondi studenti aier,Al rosc l’è ded fianc a l’os,In ghin pio’ i catein sovra la tevla ,M’a sgrafigne al gat  M’a sgrafigne la gata 
616857-616848-63554494,Femminile,,53,Secondarie Superiori,Caposala,Pavullo nel Frignano ,Castelfranco Emilia  ,25,Sí,Castelfranco Emilia-Modena,Italiano ,Italiano da padre e madre,Inglese scolastico,Italiano ,Bene,Modenese e bolognese ,Bene,Modenese e bolognese ,,Sí,,Sí,,No,,Sí,,No,,No,,No,,Sí,,Sí,,Sí,,Sí,,No,,Sí,,No,,,Sí,,Sí,,Sí,,No,,No,,Sí,,No,,No,,,,,Sí,,Sí,,No,,No,,Sí,,Sí,,Sí,,Sí,,Sí,,Sí,,Sí,,No,,No,,,,50/50,,50/50,,Mai,,,Sí,Modenese e bolognese ,,Sí,,,Sí,,,No,,,No,,,No,,,No,,,Sí,,,No,,,Sí,,,Sí,,,No,,,,,,,Ogni giorno,,Ogni giorno,,Mai,,Si,Italiano e inglese e dialetto ,Si,Insegnarlo ai figli,A casa,Perché una tradizione ,Tutte,No,Tuttw,No,ITALIANA,Essere nato in montagna come me,Essere nato in città di pianura,,2,2,2,1,1,1,2,1,Al let,Al sol ,,In sen gnienc accort,Ien arrive' dimondi student aier,Al pattom le ,,
616857-616848-63554471,Maschile,,47,Secondarie Superiori,impiegato,Carpi,Novi di Modena,8 anni,Sí,Nonantola,"Italiano, Inglese","Italiano, famiglia","Inglese, scuola + lavoro",italiano,Molto bene,modenese / carpigiano / bassa modenese,Molto bene,carpigiano,,"Sí,M,F",,"Sí,M",,"Sí,M,F",,,,,,,,,,"Sí,F",,"Sí,M,F",,"Sí,M",,"Sí,M,F",,,,,,,,,Sí,,,,,,,,,,Sí,,,,No,,,,,Sí,,No,,,,Sí,,Sí,,Sí,,No,,Sí,,Sí,,Sí,,Sí,,Sí,,,,,,Mai,,Mai,,Alle volte,inglese,"termini di lavoro quali teambuilding, ecc.",No,,,,,,,,,,,,,,,,,,,,,,,,,,,,,,,,,,,,,,,,Mai,,Mai,,Mai,,"Si, è la lingua delle mie radici",italiano e emiliano,assolutamente si,"corsi, dalle autorità locali",nella vita di tutti i giorni,"non so, non credo","quella locale, ma non a scuola","no, la scuola deve essere cosmopolita",tutte ma non a scuola,ovviamente,Italiano emiliano,Abitante delle zoneontane,abitante della città. Pianeggianteai sentito e lo trovo insensato,,3,3,3,3,3,3,3,4,al lèt,al sól,la báslèta,i'n sìn mia adèe,è arivè dimóndi studeint aier,Al rusc' l'è d'fianc á la porta,an' ghè più i baslót insima á la tevla,a m'á sgranfgnèe al gát / la gáta
