616857-616848-63688292,Femminile,,33,Laurea Triennale,Agricolo,Pistoia,GUIGLIA,33 anni,No,,Italiano,Italiano,Scuola:francese e inglese,Italiano,Bene,Modenese/bolognese,50/50,Dialetto di guiglia,,"Sí,M,F",,"Sí,M",,"Sí,M",,No,,No,,No,,No,,"Sí,M",,No,,No,,No,,No,,No,,No,,,Sí,,Sí,,No,,No,,No,,No,,No,,No,,No,,,Sí,,No,,No,,No,,No,,No,,No,,Sí,,Sí,,Sí,,Sí,,No,,No,,No,,Molto spesso,,Molto spesso,,Alle volte,Inglese,,No,,,,,,,,,,,,,,,,,,,,,,,,,,,,,,,,,,,,,,,,Ogni anno,,Mai,,Mai,,"Si, perche alcune parole esprimono meglio il concetto rispetto al italiano",Italiano,Si perché fa parte della nostra cultura,Le famiglie dovrebbero parlarne di più ,In famiglia e nel quotidiano per preservarlo e far si che si trasmetta anche ai più piccoli ,Non nella scuola come materia principale ma come materia opzionale,"In ogni zona il proprio dialetto, anche perche ogni zona ha un dialetto diverso",No perche la lingua principale è l italiano ,Nella mia zona il mio per mantenere la tradizione di ogni posto credo che in ogniuno di essi vada mantenuto il proprio,"Si, perche sapere più lingue aiuta a vedere più punti di vista. ",Italiano,Vivere in zone lontane dalla città a altitudine maggiore e più a contatto con la natura,Vivere in citta,,3,3,3,2,3,3,3,1,Al let,U Sol,Il mentoz,In snen brisa adà,Ier i en arrivé dimonde student,Il rosc li svin a l us,Eg ni pio dal bagnarole in co dala tavla,E mà sgrafigne e gat  E mà sgrafigne la gata
616857-616848-63724607,Femminile,,39,Laurea Triennale,Libero professionista ,Monfalcone,Valsamoggia,12 anni,No,,"Italiano, inglese",Italiano per tutti,Inglese per tutti,Italiano (padre)  inglese e italiano (madre),Per niente,Nessuna,Per niente,Nessuna,,,,,,,,,,,,,,,,,,,,,,,,,,,,,,,,,,,,,,,,,,,,,,,,,,,,,,,,,,,,,,,,,,,,,,,,,,,,,,,,Mai,,Spesso,"Inglese, francese, dialetti di origine","Imprecazioni, intercalare, termini legati alla tecnologia e al lavoro",No,,,,,,,,,,,,,,,,,,,,,,,,,,,,,,,,,,,,,,,,,,,,,,"No, ma mi piacerebbe capirlo",Parliamo italiano e poco inglese,"Si, perché fa parte della cultura locale",Non so,Non so,Facoltativamente. ,Non saprei," No, ritengo sia più conveniente usare l’italiano e altre lingue riconosciute ",Non saprei ,"Si, sono cresciuta parlando italiano, il dialetto della mia zona di nascita e inglese. L’apprendimento delle lingue è stato più facile per me che per altri. Ma credo abbia senso a livello familiare.",Italiano,Avere origini in zone di montagna e adottare uno stile di vita adatto alle caratteristiche del territorio,Vivere in città/pianura e adottare uno stile di vita adatto alle caratteristiche del territorio,,3,3,5,2,3,3,5,1,Non so,Non so,Non so,Non so, Non si,Non so,Non so,Non so
616857-616848-63765423,Femminile,,52,Migistrale e oltre,Docente ,Settefrati FR,Pavullo nel Frignano ,13 anni,No,,Italiano e Inglese,Italiano dalla madre e dal padre,Inglese per studio,Italiano ,Un po',Modenese,Per niente,,,,,,,,,,,,,,,,,,,,,,,,,,,,,,,,,,,,,,,,,,,,,,,,,,,,,,,,,,,,,,,,,,,,,,,,,,,,,,,,,Alle volte,Sa dis  Te'l dec...  ,Alle volte,Inglese,Ok! Of course! Thanks! ...,No,,,,,,,,,,,,,,,,,,,,,,,,,,,,,,,,,,,,,,,,,,,,,,Mi piacerebbe parlarlo perché lo ritengo un dialetto molto musicale e soprattutto per potermi integrare ancora di più. ,Noi parliamo sia in Italiano che in inglese in casa poiché il papà delle mie ragazze è americano. ,"Perché contraddistingue l'area, fa parte della cultura, della tradizione e perché è bello. ","Organizzare delle letture di testi dialettali fatte da ""nonni"", serate ""racconti"", corsi di cucina in dialetto. Sarebbe giusto che se ne occupasse l'ufficio cultura del Comune, la Pro Loco, la Biblioteca comunale e le associazioni storiche presenti sul territorio. ",Durante le serate a tema.  Si dovrebbe fare per non perderne la conoscenza. ,Si perché no ma con Progetti mirati. ,Tutte,No,,Sarebbe giusto conservarlo per mantenere legate le nuove generazioni al territorio. ,Italiano ,Far parte di un'area geografica specifica. ,Come sopra,,3,1,3,2,2,3,2,3,,,,,,,,
616857-616848-63776937,Femminile,,65,Secondarie Superiori,Pensionata,Lama Mocogno (MO),Castelnuovo Rangone (MO),sempre,No,,Italiano,Francese/Tedesco,Nessuna,Italiano,Molto bene,Modenese,Molto bene,Modenese e montanaro,,Altro,no,Altro,no,Altro,no,Altro,no,Altro,no,,,,,M,no,Altro,no,Altro,no,Altro,no,M,no,M,no,Altro,no,,No,,No,,No,,No,,,,No,,No,,No,,No,,,Sí,,Sí,,Sí,,Sí,,Sí,,Sí,,Sí,,Sí,,Sí,,Sí,,Sí,,No,,No,,No,,Spesso,in ufficio parlo italiano,Spesso,a jo fini,Mai,,,No,,,,,,,,,,,,,,,,,,,,,,,,,,,,,,,,,,,,,,,,Mai,,Mai,,Mai,,"per forza, ci sono nata",se li avessi gli insegnerei il dialetto perchè sono tradizioni che non si devono perdere,"qualsiasi dialetto va mantenuto, è una cosa storica ed esprime meglio della lingua italiana","a scuola dovrebbero farlo, ma i primi dovrebbero essere i genitori.","se sei con amici e scherzi per forza di cose si usa, poi con gli anziani.",perchè fa parte delle nostre radici,"quella del luogo di nascita, bastano pochi chilometri e cambiano già gli accenti e le parole",per mantenere le proprie usanze,"Modenese e montanaro, molto vario",parlare tante lingue serve e tutti,emiliana montanara,persona sana e schietta,persona falsa,,1,1,1,3,1,2,1,4,let,sol,ment,in sne gnec adà,ien arivà dimondi student ier,e rosc l'è atac a la porta,en ghè più al bacineli in cema a la tavla,è mà grafià e gat
616857-616848-63782689,Femminile,,25,Laurea Triennale,Educatore,Bologna,Valsamoggia,5 anni,No,,Italiano,Italiano,Italiano,Bolognese e Milanese,50/50,,Per niente,,,Sí,,No,,No,,No,,No,,No,,No,,No,,Sí,,No,,Sí,,No,,No,,No,,,,,,,,,,,,,,,,,,,,,,,,,,,,,,,,,,,,,,,,,,,,,,,,,,Molto spesso,,50/50,"Rusco oppure ""dare il tiro""",Spesso,Inglese e spagnolo,"Hello, hola, Chico, stage",No,,,,,,,,,,,,,,,,,,,,,,,,,,,,,,,,,,,,,,,,Mai,,Ogni settimana,,Mai,,"Si, perché penso sia importante non perdere ciò che è legato alla nostra tradizione","Italiano sicuramente visto dove abitiamo, ma cercherei anche di indurli verso l'inglese e lo spagnolo visto il mondo lavorativo",Si per l'importanza della tradizione,"La scuola, i genitori, eventi adatti anche ai giovani come spettacoli di teatro, menù dei ristoranti",Parlando con amici o sconosciuti per impararlo e ricordarlo,"Si, perché è una lingua che fa parte di noi",Tutte ,"Oltre alle lingue già in uso, penso si possano mettere dei corsi a scelta con il dialetto",,"Si, perché, come le altre lingue studiate a scuola, può essere un ulteriore stimolo per il bambino",Europeo,"Sapere risolvere i problemi con ciò che si ha, sentire molto il senso di comunità e volontariato, avere il senso di famiglia molto forte ","Sapere che è importante contare su stessi, avere tutto a disposizione",,4,1,2,1,1,1,4,1,,,,Am son neanca acorto,Assi rivè molti con i ieri,Il rusco è vicino alla porta,,
616857-616848-63968174,Femminile,,51,Laurea Triennale,biologa,Roma,"Lama Mocogno, (MO)",17 anni,No,,italiano,italiano da tutti,inglese dai cugini,italiano,Bene,"modenese, reggiano e dialetti montanari",Per niente,,,,,,,,,,,,,,,,,,,,,,,,,,,,,,,,,,,,,,,,,,,,,,,,,,,,,,,,,,,,,,,,,,,,,,,,,,,,,,,,,Alle volte,patterlengh,Spesso,inglese,"bias, misconceptions, build up, target,",,,,,,,,,,,,,,,,,,,,,,,,,,,,,,,,,,,,,,,,,,,,,,,"non lo parlo ma mi piacerebbe, lo trovo allegro","italiano. lascio i dialetti agli anziani,","si, come tutti i dialetti, ha un valore antropologico e culturale,ma non saprei come perchè non farei mai investire tempo utile ai giovani per studiarlo-","non so proprio, i dialetti sono lingue morte (o agonizzanti) come lo sono il greco antico e i latino , ma di non  simile valore universale ","non so, a teatro, nelle commedie, ",solo in ambito antropologico,nessuuna e tutte,assolutamente no,,"no ! uun dialetto non è per niente la stessa cosa di una lingua. 2 lingue diverse sono 2 modalità diverse di strutturarsi e non solo vocaboli diversi, una lingua diversoa ti mette in contatto con una poplazione e tradizione diversa, ti apre a nuovi territori, il dialetto ti fa mettere afuoco più da vicino quualcosa di dove già sei immerso",italiana,"essere legati al territorio, saper riconoscere il valore della vita reale, sapersela cavare senza le semplificazioni e le comodità della città",piangiano voleva dire? vita comoda e a volte un pò superficiale,,4,3,4,2,2,3,5,2,al lèt,,,,et en arrivà un mont de sculàr estraner aier,al rusc et al port,,m'ha grafià el gàt
616857-616848-64043127,Femminile,,22,Laurea Triennale,Studentessa,Bologna,Bologna,22 anni ,No,,"Italiano, spagnolo, inglese",Italiano genitori  ,Spagnolo scuola  Inglese scuola,Italiano,50/50,Bolognese,50/50,Bolognese,,"Sí,M,F",,"No,M,F",,"No,M,F",,"No,M,F",,"No,M,F",,"No,M,F",,"No,M,F",,"No,M,F",,"No,M,F",,"No,M,F",,"No,M,F",,"No,M,F",,"No,M,F",,"No,M,F",,,No,,Sí,,No,,No,,No,,No,,No,,No,,No,,,Sí,,No,,No,,No,,Sí,,No,,No,,Sí,,No,,Sí,,No,,No,,No,,No,,50/50,,Alle volte,,Alle volte,Inglese,,No,,,,,,,,,,,,,,,,,,,,,,,,,,,,,,,,,,,,,,,,Mai,,Mai,,Mai,,Si mi piacerebbe impararlo,Inglese perché ho studiato all'estero ,Si,Tramandarlo insegnando a scuola,Elementari,No ,Bolognese,No,Bolognese perché sono di Bologna ,Indifferente,Italiana e bolognese,Vivere in montagna ,Vivere in città ,,4,3,4,1,3,2,5,3,,,,,,Il rusco è accanto alla porta,,
616857-616848-64043113,Maschile,,25,Laurea Triennale,Studente ,Bologna,Bologna,25 anni,No,,Italiano ,"Italiano, madre, padre, nonni ","Inglese, scuola ",Italiano,Bene,Bolognesd,50/50,Bolognese,,No,,Sí,Solo in momenti di ilarità,No,,No,,No,,No,,No,,No,,No,,No,,No,,No,,No,,No,,,No,,No,,No,,No,,No,,No,,No,,No,,No,,,No,,No,,No,,No,,No,,No,,No,,Sí,,No,,No,,Sí,,No,,No,,No,,Spesso,,Spesso,,Mai,,,No,,,,,,,,,,,,,,,,,,,,,,,,,,,,,,,,,,,,,,,,Mai,,Mai,,Mai,,"Mi piace in determinati contesti, di leggerezza. Il altri contesti non saprei esprimermi con i giusti termini ","Italiano, il dialetto non lo ritengo importante ","Non necessariamente, non mi importa molto delle tradizioni ","Non saprei, a scuola sarebbe insegnato a discapito di altre materie più importanti, che mi sembra una follia. Forse l'unica cosa saggia sarebbe sostituirlo all'ora di religione ","Tra amici o tra chi lo conosce, per non escludere nessuno","No, ci sono cose ben più importanti da insegnare e le ore sono poche ","Se proprio volessimo insegnarlo, allora quella della città di origine","No, assolutamente. L'università e la scuola in genere dovrebbero espandere i confini, non stringerli",,"No, assolutamente. Sarebbe meglio imparare un'altra lingua, come l'inglese ",Europeo ,"Vivere, crescere e pensare come una ristretta comunità di persone che vivono secondo standard differenti rispetto agli abitanti della città ",Essere più globali,,2,2,2,5,4,3,2,4,Al let,Al soul,,,,,,
616857-616848-64043114,Maschile,,27,Migistrale e oltre,Insegnante ,Soave ,Bologna ,7 anni ,No,,Italiano ,Italiano dai genitori ,"Inglese (scuola), francese (scuola), dialetto Veneto (famiglia), dialetto Emiliano (amici) ",Italiano ,50/50,Bolognese ,Un po',Bolognese ,,"No,M,F",,"Sí,M,F",Qualche frase ,"No,M,F",,"No,M,F",,"No,M,F",,"Sí,M,F",,"No,M,F",,"No,M,F",,"No,M,F",,"No,M,F",,"No,M,F",,"No,M,F",,"No,M,F",,"No,M,F",,,Sí,Qualche frasetta ,No,,No,,No,,No,,Sí,Qualche frasetta,No,,No,,No,,,Sí,,Sí,,No,,No,,Sí,,No,,No,,Sí,,No,,Sí,,Sí,,No,,No,,No,,,,50/50,"Sorbole, soccia, vez, pollegg, biga, rusco, tiro, regaz, rega, balotta",Spesso,Inglese ,,No,,,,,,,,,,,,,,,,,,,,,,,,,,,,,,,,,,,,,,,,,,,,,,È divertente ,Italiano ,È sicuramente una preziosa perla della cultura e tradizione locale ,Far conoscere la cultura popolare dai nonni ,A casa o in contesti extrascolastici,Secondo me no. Nelle istituzioni scolastiche e universitarie si deve dare spazio agli insegnamenti istituzionali come italiano e lingue straniere,Nessuna ,No. Per favorire lo scambio di idee ci vogliono le lingue di cultura istituzionalizzate,,Sicuramente aiuta ,Europeo e italiano ,Una persona che abita in montagna ,Una persona che abita in campagna ,,3,3,3,4,4,3,3,3,,,,,,,,
616857-616848-64043061,Maschile,,30,Laurea Triennale,Attore,Bologna ,Bologna ,30 anni,No,,Italiano ed Inglese,Italiano Padre e Madre,Inglese scuola,Italiano,Bene,Bolognese ,Un po',Bolognese ,,Sí,,Sí,,Sí,,,,,,,,,,Sí,,,,,,,,,,,,,,,Sí,,,,,,,,,,Sí,,,,,,,,,Sí,,,,,,,,,,,,,,Sí,,Sí,,Sí,,Sí,,,,,,,,Molto spesso,,Molto spesso,,Alle volte,"Inglese, Francese e Spagnolo",,No,,,,,,,,,,,,,,,,,,,,,,,,,,,,,,,,,,,,,,,,Mai,,Mai,,Mai,,Perché è una lingua e non possederla lo trovo un impoverimento culturale.,Italiano e Bolognese,"Sì, andrebbe recuperato ma la vedo dura. Per arricchire il nostro vocabolario e darci l’opportunità di pensare meglio. Nella lingua dialettale si scoprono anche mondi che ci appartengono. ",Studiarlo a scuola  e parlarlo di più In casa.,"Per strada, in casa, con gli amici. Per comunicare meglio,",Sì.,Tutte.,"No, non dovrebbe diventare discriminante. ","Bolognese, perché sono di Bologna.",Ho già detto sopra.,"L’identità è una menzogna, quindi non sono Italiano, nemmeno Bolognese. Parlare la lingua della terra in cui sono nato mi piace, perché sento che in quel modo di parlare c’è una parte di me, del mio modo di pensare e di fare. ",Vivere in montagna ,Vivere in città ,,3,3,3,3,3,3,3,2,A Let,Al sol,,An San brisa accort,,Al rusc l’è sopra al l’uscio,,M’ha graffiè al gat 
616857-616848-64043126,Femminile,,18,Secondarie Superiori,studente,Bologna,Bologna,18 anni,No,,italiano,"nonno, nonna e padre","inglese, spagnolo, tedesco a scuola",italiano,Bene,Bolognese,Un po',,,Sí,,Sí,,No,,Sí,,No,,No,,No,,Sí,,No,,No,,Sí,,No,,No,,Sí,,,Sí,,Sí,,No,,Sí,,,,,,No,,No,,,,,Sí,,Sí,,No,,Sí,,Sí,,Sí,,Sí,,Sí,,Sí,,Sí,,Sí,,No,,No,,,,50/50,,50/50,,Spesso,"spagnolo, inglese e tedesco",,No,,,,,,,,,,,,,,,,,,,,,,,,,,,,,,,,,,,,,,,,Mai,,Ogni anno,,Mai,,si mi piace,dialetto e le lingue che studio per un'apertura mentale,si,i ragazzi dovrebbero parlare sempre in dialetto con i nonni,con amici e parenti,"si, per imparare la propria lingua",bolognese,"dipende, magari parlare italiano e poi tradurlo in dialetto o viceversa","bolognese, per la musicità",si,italiano,vivere in montagna,vivere in città o in pianura,,3,2,2,1,1,2,3,2,leet,sool,gaget,i s'nee gnanc acort,i s'en arivee dimonti student aiir ,al rosc l'e at'ac a la porta,an ghe più bazineli in vetaa la tevla,a m'a sgranfgnee al gat/ la gata
616857-616848-64043185,Maschile,,17,Primarie/Medie,Studente,Bologna,Granarolo dell'Emilia,17 anni,No,,Veneto Bolognese Italiano,Veneto e Italiano dalla nonna ,Bolognese da i vecchi della parrocchia,Toscano e veneto,Molto bene,Bolognese,Un po',Bolognese,,,,,,,,,,,,,,,,,,,,,,,,,,,,,,,,,,,,,,,,,,,,,,,,,,,,,,,,,,,,,,,,,,,,,,,,,,,,Sí,Per parlare con i campanari,Spesso,,50/50,"Soccia, a tal dig, liver, mica, Gubbiare, paccare, il tiro...",Mai,,,No,,,,,,,,,,,,,,,,,,,,,,,,,,,,,,,,,,,,,,,,,,,,,,"Mi piacerebbe molto parlarlo, mi piacerebbe se facessero altri corsi per impararlo",Se avessi figli e se sapessi parlare il dialetto parlerei con quello con loro,Non bisogna assolutamente perderlo,Fare più corsi e pubblicizzarli soprattutto nei piccoli paesi come Granarolo ,Nella vita quotidiana,"Studiato no, perché è un dialetto e secondo me è fatto per arricchire la vita quotidiana paesana",Bolognese,Non credo si possa ma sarebbe bello,Bolognese,Si,Emiliano,"Avere atteggiamenti da montanaro, essere una persona alla mano di poche parole ma molto pratica","Magari tiene più a certe cose, come a fare trovare agli ospiti ordine e pulizia in casa",,1,1,3,1,2,2,4,1,Il letto,Al såul,La bazza,Aiè brisa acort,Aie arrivè pareci student a ier,Il rusco le li di fianco alla porta,Aie brisa bacinel sulla tavola,
616857-616848-64043081,Femminile,,54,Secondarie Superiori,Impiegata,Bologna,Castel Maggiore ,Dal 1995,No,,Italiano,Italiano,Italiano,Italiano,Molto bene,Dialetto bolognese,50/50,Dialetto bolognese,,No,"I miei genitori parlanontra loro il dialetto bolognese, ma con me parlano prevalentemente in italiano",No,,No,,No,,No,,No,,No,,No,,No,,No,,No,,No,,No,,No,,,No,,No,,No,,No,,No,,No,,No,,No,,No,,,Sí,,Sí,,No,,No,,No,,Sí,,No,,Sí,,Sí,,Sí,,Sí,,No,,No,,No,,Spesso,,Spesso,,50/50,Inglese o francese per modi di dire o termini tecnici,,No,,,,,,,,,,,,,,,,,,,,,Sí,Sí,,,,,,,,Sí,Sí,,,,,,,,,Mai,,Mai,,Mai,,"Con i famigliari a volte lo parliamo, per scherzare","Italiano, perché comunque è la lingua ufficiale",Si assolutamente. Andrebbe insegnato ,"A scuola con corsi speciali tenuti da anziani o comunque da chi lo parla correntemente, come se fosse una lingua straniera","Ma magari anche solo in famiglia, ma non si dovrebbe perdere l uso ","So, per mantenerlo vivo","Per me il dialetto bolognese, per quanto detto sopra","Si, per quanto detto sopra","Il dialetto bolognese, perché io sono di Bologna, ma magari il modenese per chi è di Modena e così via....","Si, per il motivo che dite anche voi","Emiliana, italiana, europea",Essere nato in montagna ed aver mantenuto origini e cultura,Essere nato ed aver mantenuto tradizioni e cultura,,2,2,3,1,3,3,3,1,Al let,Al soul,Al ment,I sen gnanc acurt,Ien arivee dimondi student iir,Al rosc l è lè asven a la porta ,A gne piò catinelle invata a la tevla,Al m ha sgranfignè al gat - la m ha sgranfignè la gata
616857-616848-64043381,Femminile,,22,Laurea Triennale,Studente,Bologna,Bologna,22 anni,Sí,,Bologna - Forlì,"Italiano, genitori","Inglese, scuola",Italiano,Un po',Dialetto bolognese,Per niente,,,,,,,,,,,,,,,,,,,,,,,,,,,,,,,,,,,,,,,,,,,,,,,,,,,,,,,,,,,,,,,,,,,,,,,,,,,,,,,,,Alle volte,"Rusco, tiro, socc mel, socci",Alle volte,Inglese,"Cash, show",No,,,,,,,,,,,,,,,,,,,,,,,,,,,,,,,,,,,,,,,,Mai,,Mai,,Mai,,Si mi piacerebbe saperlo parlare perché mi affascinano i dialetti,"Italiano, perché è quella che parlo comunemente e per facilitare loro l'apprendimento del l'italiano alla scuola dell'obbligo",Si per mantenere anche la storia dei nostri territori,Dovrebbe essere trasmesso di più tra le famiglie,In famiglia,"No, non è una lingua ufficiale o spendibile in altri contesti",Nessuna,No,Bolognese,No,Italiana/europea,Vivere in collina o in montagna lontani dal centro città,"Vivere in città, centro, con atteggiamenti frenetici",,5,3,3,1,3,3,3,3,Letto,Sole,Mento,,,Il Rusco è accanto alla porta,,
616857-616848-64043244,Femminile,,23,Laurea Triennale,Studente,Bentivoglio,Baricella,23 anni,No,,Dialetto bolognese e italiano,Italiano madre padre nonna e nonno,Svedese autodidatta,Italiano e dialetto bolognese,Molto bene,,50/50,,,"Sí,Altro",,"Sí,Altro",,"No,Altro",,"Sí,Altro",,"No,F",,"Sí,Altro",,"No,Altro",,"No,Altro",,"No,Altro",,"No,Altro",,"Sí,Altro",,"No,Altro",,"No,Altro",,"No,Altro",,,No,,No,,No,,No,,No,,No,,No,,No,,Sí,In privato,,Sí,,No,,Sí,,No,,No,,No,,No,,Sí,,Sí,,No,,Sí,,No,,No,,No,,Molto spesso,Soccmel che bello,50/50,Butteresti il rusco?,50/50,Inglese e spagnolo,Facciamo una call?/ Che guapa,No,,,,,,,,,,,,,,,,,,,,,,,,,,,,,,,,,,,,,,,,Mai,,Mai,,Mai,,Certo,Italiano Inglese e qualche modo di dire e parola di dialetto,Non ne sono sicura,Le scuole,In situazioni familiari,"Sì, per arricchimento personale",Tutte indistintamente,"No, non è una lingua ufficiale",Tutte,No poiché credo sia più importante un altra lingua come l'inglese piuttosto che il dialetto,Italiana,Vivere in montagna o appassionato di essa,Vivere in pianura padana,,4,2,2,1,1,3,4,1,Al let,Al saul,La barusle,Ans ni son brise acourt,Jir a son gno un branco ad cinno c'studievan,Al rosc l'è d'bande l'osch,Anjen pió i catinele indla tevle,Non saprei
616857-616848-64043551,Femminile,,20,Secondarie Superiori,Studentessa,Bologna,Bologna,20 anni,Sí,Bologna - Ferrara,Italiano,"Italiano, dai genitori","Inglese, a scuola",Italiano,50/50,Bolognese,Per niente,,,,,,,,,,,,,,,,,,,,,,,,,,,,,,,,,,,,,,,,,,,,,,,,,,,,,,,,,,,,,,,,,,,,,,,,,,,,,,,,,Spesso,,Alle volte,"Inglese, francese",,No,,,,,,,,,,,,,,,,,,,,,,,,,,,,,,,,,,,,,,,,Mai,,Mai,,Mai,,Mi piacerebbe saperlo parlare perché rappresenta le mie origini,"Italiano, perché è importante saperlo parlare correttamente","Sì, perché è importante mantenere vive le proprie origini",Corsi facoltativi a scuola,Per parlare con familiari/amici,"Sì, per tenere viva la tradizione e comprenderne al meglio le origini","Bolognese nel territorio di Bologna, modenese nel territorio di Modena","No, perché la lingua ufficiale è l'italiano e si creerebbero fraintendimenti e incomprensioni con altre regioni",,Credo sia importante ,Italiana,"Abitare in montagna, isolato","Abitare in pianura, nelle città",,3,3,3,2,3,3,4,2,,,,,,,,
616857-616848-64043505,Femminile,,20,Secondarie Superiori,Studente,Bologna,Bologna,20 anni,No,,Italiano,Italiano ,Spagnolo/inglese,Italiano,Bene,Bolognese,Un po',Bolognese,,Sí,,No,,Sí,,No,,No,,No,,No,,No,,No,,No,,No,,No,,No,,No,,,No,,Sí,,No,,No,,No,,No,,No,,No,,No,,,Sí,,No,,No,,Sí,,Sí,,No,,No,,Sí,,Sí,,Sí,,Sí,,No,,No,,No,,Molto spesso,,Molto spesso,"Rusco, dammi il tiro, sorbole...",Alle volte,Inglese,,No,,,,,,,,,,,,,,,,,,,,,,,,,,,,,,,,,,,,,,,,Mai,,Mai,,Mai,,"Si, fa parte del mio essere bolognese, lo sento mio. I miei nonni mi hanno cresciuta parlando bolognese","Italiano, inglese e spagnolo.  Perchè sono le lingue più parlate e utili da sapere","Si, perché fa parte delle nostre origini, sarebbe un peccato perderlo","I giovani dovrebbero interessarsi maggiormente, con l'aiuto dei proprio nonni/genitori",In casa così da farlo proprio ,"No, forse qualche approfondimento di cultura generale","Bolognese, essendo il capoluogo dell'emilia Romagna ",No,,"Si, può sempre essere utile",Cittadina del mondo,"Montanaro è chi abita nelle zone più alte, Tolè, Zocca l, lontano dai paesi più popolati",Chi abita in centro o vicino,,3,2,3,1,1,3,2,1,Al let,Al soul,Maint,An san brisa accort,Ad son arrivè tan studaint air,Il Rusco a le lè da la porta,Ai son brisa al bacinel in tlà tavola,
616857-616848-64043577,Maschile,,18,Secondarie Superiori,Studente,Cento,San Giovanni in Persiceto ,18 anni,Sí,San giovanni in persiceto - bologna ,Italiano e dialetto bolognese,"Italiano, genitori ","Dialetto bolognese, nonni",Italiano e dialetto ,Molto bene,Bolognese,Un po',Bolognese ,,"Sí,M,F",,"Sí,M,F",,"Sí,M,F",,No,,"No,M,F",,"Sí,M,F",,"No,M,F",,"Sí,Altro",,"No,M,F",,"Sí,M,F",,No,,No,,No,,No,,,Sí,,Sí,,Sí,,No,,No,,Sí,,No,,No,,No,,,Sí,,No,,No,,Sí,,Sí,,Sí,,No,,Sí,,Sí,,Sí,,Sí,,No,,No,,No,,50/50,,Alle volte,,Alle volte,,,Sí,Bolognese,,Sí,No,,Sí,No,,No,No,,Sí,No,,Sí,No,,Sí,No,,Sí,No,,No,No,,Sí,No,,No,No,,Sí,No,Facebook,No,No,,,Mai,,Mai,,Mai,,Mi piace parlare emiliano perchè mi fa sentire legato al mio territorio ,Si perché penso sia importante preservare il dialetto ,Si perché fa parte della nostra storia e tradizione ,Bisognerebbe iniziare ad insegnarlo nelle scuole,Con amici e parenti ,Si perché è parte della nostra cultura ,"Tutte le varietà a seconda della zona, ma principalmente il bolognese ",No perchè la lingua nazionale rimane l'italiano ,,No perchè penso già che vorrebbe insegnato ,"Emiliano, italiano e infine europeo ",Montanaro è colui che vive in paesini sperduti di montagna e che tende a essere una persona concreta ,"Cittadino è chi abita in città, intesa come opposizione della campagna, una persona meno concreta e legata al lavoro manuale ",,2,2,2,1,2,2,3,1,Al let,Al soul,Al ment,In sen manc accort ,Son arivè molt studint ir,Al rosc lè teis a la porta,An ghen piò al catinel sovra la tevla,M'ha grafiè al gat
616857-616848-64043720,Femminile,,20,Laurea Triennale,Studente,Cento,Castello d'argile ,Sempre,Sí,San pietro in casale- ferrara,Italiano   Dialetto bolognese,"Italiano, madre e padre",Dialetto nonno  Inglese e spagnolo scuola,Italiano,Bene,Bolognese,Bene,Bolognese,,"Sí,M,F",,No,,No,,No,,No,,Sí,,No,,No,,No,,No,,No,,No,,No,,,,,Sí,,No,,No,,No,,No,,No,,No,,No,,,,,Sí,,No,,No,,Sí,,Sí,,No,,No,,Sí,,Sí,,Sí,,Sí,,Sí,,No,,,,Alle volte,,50/50,,Spesso,Inglese e spagnolo,,No,,,,,,,,,,,,,,,,,,,,,,,,,,,,,,,,,,,,,,,,,,,,,,Si,Emiliano e lingue straniere ,Si perché è tradizione,Scuola,Tempo libero,Si ,Bolognese,No,,Si,Italiano e bolognese,Dalla montagna,Dalla città ,,3,3,3,5,4,3,3,4,Let,Sol,Ment,An i son brisa acorti,,,,
616857-616848-64043771,Maschile,,21,Secondarie Superiori,Studente,Faenza,Bologna,21 anni,No,,"Italiano, inglese","Italiano, famiglia in generale","Inglese, scuola",Italiano,Un po',Bolognese,Un po',Bolognese,,Sí,,No,,No,,No,,No,,No,,No,,Sí,,No,,No,,No,,No,,No,,No,,,Sí,,Sí,,No,,No,,No,,No,,No,,No,,No,,,Sí,,No,,No,,Sí,,No,,No,,No,,Sí,,No,,No,,No,,No,,No,,No,,Spesso,,Alle volte,,Alle volte,,,No,,,,,,,,,,,,,,,,,,,,,,,,,,,,,,,,,,,,,,,,Mai,,Mai,,Mai,,"Si, è un modo per sentirsi a casa","Italiano, inglese","Si, fa parte della tradizione e della storia della nostra zona, oltre a rappresentare la base di certi modi di dire","Si, da chiunque lo sappia parlare",Nel parlato non ufficiale,"No, non è un linguaggio valido a livello italiano e tanto meno internazionale ","Tutti, ogni zona deve mantenere le sue abitudini","No, stesso motivo di prima ",,Credo sia più importante conoscere l'inglese,"Italiano, emiliano ed europeo ",Persona che vive in zona montana o appenninica  Oppure persona un po' rustica,Persona che vive in zona cittadina e a livello storico più colta e benestante,,2,3,3,2,2,4,5,2,,,,,,,,
