Unique Response Number,1. Sesso,"1.a. Se selezionate ALTRO , prego di specificare",2. Etá,3. Livello di istruzione piú alta,4. Occupazione,5. Luogo di nascita,6. Luogo di residenza,6.a. Per quanto tempo,7. Pendolare?,"7.a. Se sí, specificare la tratta",8. Lingue parlate in famiglia,"9. Lingue acquisite per prima e da chi (es: madre, padre, nonna, etc)",10. Lingue acquisite piú tardi e da chi,11. Lingue dei genitori,12. Capisce l'emiliano parlato?,12.a. Quale varietá?,13. Parla emiliano?,13.a. Quale varietá?,14. Con chi? Risponda solo se ha detto di saper parlare emiliano,14.1.a. Familiari - Selezioni Sí o No per ogni opzione e indichi sesso,14.1.b. Familiari - Usi questo spazio nel caso voglia aggiungere ulteriori commenti,14.2.a. Amici - Selezioni Sí o No per ogni opzione e indichi sesso,14.2.b. Amici - Usi questo spazio nel caso voglia aggiungere ulteriori commenti,14.3.a. Vicini - Selezioni Sí o No per ogni opzione e indichi sesso,14.3.b. Vicini - Usi questo spazio nel caso voglia aggiungere ulteriori commenti,"14.4.a. Compagni di asilo, primaria, medie, superiori - Selezioni Sí o No per ogni opzione e indichi sesso","14.4.b. Compagni di asilo, primaria, medie, superiori - Usi questo spazio nel caso voglia aggiungere ulteriori commenti","14.5.a. Insegnanti di asilo, primaria, medie, superiori - Selezioni Sí o No per ogni opzione e indichi sesso","14.5.b. Insegnanti di asilo, primaria, medie, superiori - Usi questo spazio nel caso voglia aggiungere ulteriori commenti",14.6.a. Compagni di universitá - Selezioni Sí o No per ogni opzione e indichi sesso,14.6.b. Compagni di universitá - Usi questo spazio nel caso voglia aggiungere ulteriori commenti,14.7.a. Docenti universitari - Selezioni Sí o No per ogni opzione e indichi sesso,14.7.b. Docenti universitari - Usi questo spazio nel caso voglia aggiungere ulteriori commenti,14.8.a. Proprio/a compagno/a - Selezioni Sí o No per ogni opzione e indichi sesso,14.8.b. Proprio/a compagno/a - Usi questo spazio nel caso voglia aggiungere ulteriori commenti,14.9.a. Conoscenze - Selezioni Sí o No per ogni opzione e indichi sesso,14.9.b. Conoscenze - Usi questo spazio nel caso voglia aggiungere ulteriori commenti,14.10.a. Colleghi - Selezioni Sí o No per ogni opzione e indichi sesso,14.10.b. Colleghi - Usi questo spazio nel caso voglia aggiungere ulteriori commenti,14.11.a. Sconosciuti (emiliani) - Selezioni Sí o No per ogni opzione e indichi sesso,14.11.b. Sconosciuti (emiliani) - Usi questo spazio nel caso voglia aggiungere ulteriori commenti,14.12.a. Prete - Selezioni Sí o No per ogni opzione e indichi sesso,14.12.b. Prete - Usi questo spazio nel caso voglia aggiungere ulteriori commenti,14.13.a. Dottore - Selezioni Sí o No per ogni opzione e indichi sesso,14.13.b. Dottore - Usi questo spazio nel caso voglia aggiungere ulteriori commenti,14.14.a. Altri - Selezioni Sí o No per ogni opzione e indichi sesso,14.14.b. Altri - Usi questo spazio nel caso voglia aggiungere ulteriori commenti,15. Dove? Risponda solo se ha detto di saper parlare emiliano,15.1.a. Bar - Selezioni Sí o No per ogni opzione,15.1.b. Bar - Usi questo spazio se vuole aggiungere ulteriori commenti,15.2.a. Mercato - Selezioni Sí o No per ogni opzione,15.2.b. Mercato - Usi questo spazio se vuole aggiungere ulteriori commenti,15.3.a. Negozio (quale?) - Selezioni Sí o No per ogni opzione,15.3.b. Negozio (quale?) - Usi questo spazio se vuole aggiungere ulteriori commenti,15.4.a. Scuola - Selezioni Sí o No per ogni opzione,15.4.b. Scuola - Usi questo spazio se vuole aggiungere ulteriori commenti,15.5.a. Universitá - Selezioni Sí o No per ogni opzione,15.5.b. Universitá - Usi questo spazio se vuole aggiungere ulteriori commenti,15.6.a. Lavoro - Selezioni Sí o No per ogni opzione,15.6.b. Lavoro - Usi questo spazio se vuole aggiungere ulteriori commenti,15.7.a. Chiesa - Selezioni Sí o No per ogni opzione,15.7.b. Chiesa - Usi questo spazio se vuole aggiungere ulteriori commenti,15.8.a. Uffici pubblici - Selezioni Sí o No per ogni opzione,15.8.b. Uffici pubblici - Usi questo spazio se vuole aggiungere ulteriori commenti,15.9.a. Altro - Selezioni Sí o No per ogni opzione,15.9.b. Altro - Usi questo spazio se vuole aggiungere ulteriori commenti,"16. Quando parla emiliano, di che cosa parla? Risponda solo se ha detto di saper parlare emiliano",16.1.a. Saluti - Selezioni Sí o No a seconda se parla emiliano per queste tematiche,16.1.b. Saluti - Usi questo spazio nel caso voglia aggiungere ulteriori commenti,16.2.a. Auguri/condoglianze - Selezioni Sí o No a seconda se parla emiliano per queste tematiche,16.2.b. Auguri/condoglianze - Usi questo spazio nel caso voglia aggiungere ulteriori commenti,16.3.a. Calcoli (mentali) - Selezioni Sí o No a seconda se parla emiliano per queste tematiche,16.3.b. Calcoli (mentali) - Usi questo spazio nel caso voglia aggiungere ulteriori commenti,16.4.a. Al telefono - Selezioni Sí o No a seconda se parla emiliano per queste tematiche,16.4.b. Al telefono - Usi questo spazio nel caso voglia aggiungere ulteriori commenti,16.5.a. Per parlare di fatti quotidiani - Selezioni Sí o No a seconda se parla emiliano per queste tematiche,16.5.b. Per parlare di fatti quotidiani - Usi questo spazio nel caso voglia aggiungere ulteriori commenti,16.6.a. Per raccontare storie - Selezioni Sí o No a seconda se parla emiliano per queste tematiche,16.6.b. Per raccontare storie - Usi questo spazio nel caso voglia aggiungere ulteriori commenti,16.7.a. Per parlare di politica - Selezioni Sí o No a seconda se parla emiliano per queste tematiche,16.7.b. Per parlare di politica - Usi questo spazio nel caso voglia aggiungere ulteriori commenti,16.8.a. Per scherzare - Selezioni Sí o No a seconda se parla emiliano per queste tematiche,16.8.b. Per scherzare - Usi questo spazio nel caso voglia aggiungere ulteriori commenti,16.9.a. Per esprimere rabbia - Selezioni Sí o No a seconda se parla emiliano per queste tematiche,16.9.b. Per esprimere rabbia - Usi questo spazio nel caso voglia aggiungere ulteriori commenti,16.10.a. Per esprimere gioia - Selezioni Sí o No a seconda se parla emiliano per queste tematiche,16.10.b. Per esprimere gioia - Usi questo spazio nel caso voglia aggiungere ulteriori commenti,16.11.a. Per dire parolacce - Selezioni Sí o No a seconda se parla emiliano per queste tematiche,16.11.b. Per dire parolacce - Usi questo spazio nel caso voglia aggiungere ulteriori commenti,16.12.a. Per pensare - Selezioni Sí o No a seconda se parla emiliano per queste tematiche,16.12.b. Per pensare - Usi questo spazio nel caso voglia aggiungere ulteriori commenti,16.13.a. Per pregare - Selezioni Sí o No a seconda se parla emiliano per queste tematiche,16.13.b. Per pregare - Usi questo spazio nel caso voglia aggiungere ulteriori commenti,16.14.a. Altro - Selezioni Sí o No a seconda se parla emiliano per queste tematiche,16.14.b. Altro - Usi questo spazio nel caso voglia aggiungere ulteriori commenti,17. Usa parole italiane quando parla emiliano? Risponda solo se ha detto di saper parlare emiliano,17.a. Esempi,18. Usa parole emiliane quando parla italiano?,18.a. Esempi,19. Usa parole di altre lingue quando parla italiano?,19.a. Quali lingue?,19.b. Esempi,20. Legge e scrive in emiliano?,20.a. Quale varietá?,21. Che tipo di testi? Risponda solo se ha detto di leggere e scrivere in emiliano,21.1.a. Romanzi/storie/poesie - Leggo,21.1.b. Romanzi/storie/poesie - Scrivo,21.1.c. Romanzi/storie/poesie - Usi questo spazio nel caso voglia aggiungere ulteriori commenti,21.2.a. Quotidiani e altra stampa (specifichi) - Leggo,21.2.b. Quotidiani e altra stampa (specifichi) - Scrivo,21.2.c. Quotidiani e altra stampa (specifichi) - Usi questo spazio nel caso voglia aggiungere ulteriori commenti,21.3.a. Materiali didattici (specifichi) - Leggo,21.3.b. Materiali didattici (specifichi) - Scrivo,21.3.c. Materiali didattici (specifichi) - Usi questo spazio nel caso voglia aggiungere ulteriori commenti,21.4.a. Depliants - Leggo,21.4.b. Depliants - Scrivo,21.4.c. Depliants - Usi questo spazio nel caso voglia aggiungere ulteriori commenti,21.5.a. Altri materiali promozionali (specifichi) - Leggo,21.5.b. Altri materiali promozionali (specifichi) - Scrivo,21.5.c. Altri materiali promozionali (specifichi) - Usi questo spazio nel caso voglia aggiungere ulteriori commenti,21.6.a. Altri materiali di stampa (specifichi) - Leggo,21.6.b. Altri materiali di stampa (specifichi) - Scrivo,21.6.c. Altri materiali di stampa (specifichi) - Usi questo spazio nel caso voglia aggiungere ulteriori commenti,21.7.a. Messaggi sul cellulare - Leggo,21.7.b. Messaggi sul cellulare - Scrivo,21.7.c. Messaggi sul cellulare - Usi questo spazio nel caso voglia aggiungere ulteriori commenti,21.8.a. E-mail - Leggo,21.8.b. E-mail - Scrivo,21.8.c. E-mail - Usi questo spazio nel caso voglia aggiungere ulteriori commenti,21.9.a. Facebook - Leggo,21.9.b. Facebook - Scrivo,21.9.c. Facebook - Usi questo spazio nel caso voglia aggiungere ulteriori commenti,21.10.a. WhatsApp - Leggo,21.10.b. WhatsApp - Scrivo,21.10.c. WhatsApp - Usi questo spazio nel caso voglia aggiungere ulteriori commenti,21.11.a. Social media (specifichi) - Leggo,21.11.b. Social media (specifichi) - Scrivo,21.11.c. Social media (specifichi) - Usi questo spazio nel caso voglia aggiungere ulteriori commenti,21.12.a. Altri - Leggo,21.12.b. Altri - Scrivo,21.12.c. Altri - Usi questo spazio nel caso voglia aggiungere ulteriori commenti,22. Programmi TV/Radio in emiliano e uso dell'emiliano su internet,22.1.a. Guardo programmi TV in emiliano - Quanto spesso?,"22.1.b. Guardo programmi TV in emiliano - Specifichi cosa (quali siti, quali programmi, etc)",22.2.a. Ascolto programmi radio in emiliano - Quanto spesso?,"22.2.b. Ascolto programmi radio in emiliano - Specifichi cosa (quali siti, quali programmi, etc)",22.3.a. Ascolto/Scrivo in emiliano su internet - Quanto spesso?,"22.3.b. Ascolto/Scrivo in emiliano su internet - Specifichi cosa (quali siti, quali programmi, etc)","23. Le piace parlare emiliano? Se non lo parla, le piacerebbe poterlo parlare? Perché?","24. Se ha/avesse figli, in quali lingue parlerebbe con loro? Perché?",25. Pensa che l’emiliano dovrebbe essere mantenuto? Perché?,"26. Cosa dovrebbe essere fatto per preservare e mantenere l’emiliano, e chi dovrebbe farlo?",27. Dove e quando si dovrebbe usare l’emiliano? Perché?,28. Pensa che l’emiliano dovrebbe essere studiato a scuola/universitá? Perché?,29. Quale varietá di emiliano andrebbe insegnata? Perché?,30. Pensa che si dovrebbe usare l’emiliano come lingua dell’istruzione nelle scuole e universitá? Perché?,31. Quale varietá di emiliano le piacerebbe venisse usata? Perché?,"32. Studi recenti dimostrano che crescere parlando due o piú lingue porta vantaggi quali maggior concentrazione, miglior attenzione, memoria, e creativitá. Sapere questo la fa riconsiderare il valore dell'emiliano e il suo ruolo nella crescita di un bambino? Perché?","33. Come si definirebbe in termini di identiá? (Es: italiano, emiliano, europeo, etc…)",34. Che cosa vuole dire secondo Lei essere montanaro/a?,35. Che cosa vuole dire seondo Lei essere un cittadino/pianeggiante?,"36. Come reputa d’istinto una persona che parla emiliano?: Indichi per ogni voce della tabella (a. - h.) una delle cinque opzioni a seconda di quanto lei sia d'accordo nell'attribuire uno dei due aggettivi all'estremità della tabella ad un emiliano parlante. Se non ha forti opinioni in merito alla caratteristica indicata segnali l'opzione 3 che significa ""per me è indifferente"". Si ricordi che le valutazioni date devono essere sole impressioni su una persona che parla emiliano e quindi attribuite d'istinto: (Es. Voce a. dia 1 se la reputa istruita, 2 se abbastanza istruita, 3 se indifferente, 4 se poco istruita, 5 se non istruita)","36.1.a. a. Istruita - 1 indica un giudizio piú favorevole, 3 un giudizio neutro, 5 un giudizio negativo. Esempio: dia 1 se la reputa istruita, 2 se abbastanza istruita, 3 se indifferente, 4 se poco istruita, 5 se non istruita","36.2.a. b. Intelligente - 1 indica un giudizio piú favorevole, 3 un giudizio neutro, 5 un giudizio negativo. Esempio: dia 1 se la reputa istruita, 2 se abbastanza istruita, 3 se indifferente, 4 se poco istruita, 5 se non istruita","36.3.a. c. Diligente - 1 indica un giudizio piú favorevole, 3 un giudizio neutro, 5 un giudizio negativo. Esempio: dia 1 se la reputa istruita, 2 se abbastanza istruita, 3 se indifferente, 4 se poco istruita, 5 se non istruita","36.4.a. d. Amichevole - 1 indica un giudizio piú favorevole, 3 un giudizio neutro, 5 un giudizio negativo. Esempio: dia 1 se la reputa istruita, 2 se abbastanza istruita, 3 se indifferente, 4 se poco istruita, 5 se non istruita","36.5.a. e. Gentile - 1 indica un giudizio piú favorevole, 3 un giudizio neutro, 5 un giudizio negativo. Esempio: dia 1 se la reputa istruita, 2 se abbastanza istruita, 3 se indifferente, 4 se poco istruita, 5 se non istruita","36.6.a. f. Affidabile - 1 indica un giudizio piú favorevole, 3 un giudizio neutro, 5 un giudizio negativo. Esempio: dia 1 se la reputa istruita, 2 se abbastanza istruita, 3 se indifferente, 4 se poco istruita, 5 se non istruita","36.7.a. g. Raffinata - 1 indica un giudizio piú favorevole, 3 un giudizio neutro, 5 un giudizio negativo. Esempio: dia 1 se la reputa istruita, 2 se abbastanza istruita, 3 se indifferente, 4 se poco istruita, 5 se non istruita","36.8.a. h. Familiare - 1 indica un giudizio piú favorevole, 3 un giudizio neutro, 5 un giudizio negativo. Esempio: dia 1 se la reputa istruita, 2 se abbastanza istruita, 3 se indifferente, 4 se poco istruita, 5 se non istruita",37. Come direbbe “il letto” nel suo emiliano?,38. Come direbbe “il sole” nel suo emiliano?,39. Come direbbe “il mento” nel suo emiliano?,"40. Traduca ""Non se ne sono nemmeno accorti"" nel suo emiliano",41. Traduca “Sono arrivati molti studenti ieri” nel suo emiliano,42. Traduca “Il pattume é accanto alla porta” nel suo emiliano,43. Traduca “Non ci sono piú le bacinelle sulla tavola” nel suo emiliano,44. Traduca “Mi ha graffiato il gatto” e “Mi ha graffiato la gatta” nel suo emiliano
616857-616848-62378782,Maschile,,65,Primarie/Medie,Pensionato,Vignola,Montese ,Feb-20,No,,Italiano e dialetto frignanese,Dialetto frignanese e da genitori e nonni,"Italiano a scuola anche un po' fi francese e inglese	",Italiano e dialetto frignanese,Molto bene,Frignanese modenese bolognese. E zone limitrofe,Molto bene,Frignanese modenese bolognese e zone limitrofe,,"Sí,M,F",,"Sí,M,F",,"Sí,M,F",,"Sí,M,F",,No,Non era consentito parlare in disletto,,Non ho fatto univrrsita,,Non ho fatto univrrsita,"Sí,F",Alle scuole medie quando possibile si parlava con quasi tutti in dialetto,"Sí,M,F",,"Sí,M,F",Uomini e donne se della zona si parlava tranquillamente in dialetto,"Sí,M,F","Zone Emilia ovest e riviera romagnola ma ci si intende comunque, serve solo più tempo",No,Con i sacerdoti equasi obbligatorio l'uso dell'italiano,"Sí,F",Se il medico è della zona si parla anche in dialetto,"Sí,M,F",Chiunque lo voglia può interloquire indialetto,,Sí,,Sí,,Sí,Tutti,No,Non conosco le regoli scolastiche attuali ma temo che si debba parlare solo italiano,No,"Assolutamente in italiano a quanto mi risulta, difficile capirsi con chi proviene da lontano in dialetto",Sí,Dialetto prevslente,No,,Sí,"Italiano preminente, dialetto se necessario",,"Altro non saprei, uno col dialetto ci nasce",,Sí,Dialetto e italiano,No,Italiano,Sí,Dialetto,Sí,Tutte le lingue a seconda dei casi,Sí,Dipende con chi... Italiano e dialetto parimenti,Sí,Dialetto,Sí,Dialetto se incazzati,Sí,"Rigorosamente dialetto	",Sí,"Dialetto, da più forza...",Sí,"Mmm,,, non necessariamente italiano",Sí,Assolutamente in dialetto,Sí,"Uno pensa come meglio riesce, a seconda delle situazioni  ",No,"italiano più qualche cosa 8n dialetto, roba vecchia che nessuno ormai ricorda",Sí,Altro che? Il dialetto si parla e basta come la lingua madre,Alle volte,"Mille esempi possono non bastare, lo si fa quando si pensa che chi ascolta non abbia capito",Alle volte,Discorso uguale alla domanda precedente,Mai,"Se si parla italiano, tanto basta, francesismo inglesismi e via dicendo inquinano la lingua italiana",Nessun esempio tutti esempi,Sí,Frignanese appennino Modena est,,Sí,Sí,,No,No,,No,No,"Che significa? Carta e penna? Libri storici, storiografia trasmessa oralmente?",No,No,,Sí,No,"Quelli che mi interessano e quelli che mi capitano	",Sí,No,,Sí,Sí,In tutte le lingue che conosco anche in dialetto,No,No,Quelle che servono in itsliano,Sí,Sí,In tutte le lingue conosciute,Sí,Sí,Io in tutte le lingue conosciute,No,No,Uso solo Facebook,No,No,,,Mai,Non ci sono programmi in dialetto emiliano,Mai,Non ci sono programmi in dialetto emiliano,Ogni giorno,Facebook,Si perché lo parlo da sempre,In tutte devono conoscere le loro origini,Tutti i dialetti vanno mantenuti per memoria storico culturale,Continuare a parlarlo in famiglia al lavoro con tutti. E dovrebbe essere fatto da tutti,Nelle zone di origine fuori da quelle potrebbero nascere problemi di comprensione,"mpossibile, le sue varianti sono troppe e le persone con le giuste conoscenze troppo poche","Nessuna in particolare, sarebbe una inutile prevaricaxione",No troppi problemi,"Nessuna in particolare troppi problemi	",,"Montanaro, modenese emiliano italiano europeo.... Cittadino del mondo....	","Essere libero. Vivere in determinate zone di origine, essere sempre a contatto con la natura, cambiare orizzonte ad ogni passo e farsi accarezzare dalla neve e dal vento",Vivere in zone dove l'orizzonte e molto corto e stretto,,1,3,3,3,3,3,1,3,U let,U soli,E mentoz,In es nen gnench ada,Ier I en a riva dimonde ragaz dal scol,E rosch le svin a l'os,Engh e pio al cadinel in zema a la tavla,E gat è ma sgrafigna la gata la mee sgrafigna
616857-616848-62390914,Femminile,,29,Laurea Triennale,Studentessa,Vignola,Liverpool,3 anni,No,,Italiano e Modenese,Italiano da genitori,Modenese da genitori,Italiano e Modenese,50/50,Modenese,50/50,Modenese,,"Sí,M,F",,"Sí,M",,No,,"Sí,M",,No,,No,,No,,No,,No,,No,,No,,No,,No,,,,,Sí,Nei negozi alimentari o bar é capitato che mi parlassero in Emiliano ma io rispondevo in italiano perché non lo conosco bene e avevo paura di sbagliare,Sí,Idem sopra,No,,Sí,,No,,No,,No,,No,,,,,Sí,,No,,No,,No,,No,,No,,No,,Sí,,Sí,,Sí,,Sí,,No,,No,,No,,Molto spesso,Quando non so il termine in Emiliano,Molto spesso,"Dico spesso: Tal degh, daboun, mo tes e sa dit?! ",Alle volte,"Inglese, Francese, Arabo, Tagalog, Russo e Spagnolo",Per scherzare o se non ricordo il termine in italiano per quanto riguarda L'inglese.,Sí,Modenese,,No,No,,No,No,,No,No,,No,No,,No,No,,No,No,,No,No,,No,No,,Sí,Sí,,Sí,Sí,,No,No,,No,No,,,Mai,,Mai,,Ogni anno,"Sui post di Facebook, Instagram con amici o famigliari. Ascolto qualche volta barzellette in Emiliano.",Mi piace molto perché mi piace come Lingua e mi rappresenta,Piú lungue possibili perché secondo me é importante saperne tante. Italiano ed Emiliano per trasmettere le mie origini ai miei figli.,Sí perché penso che, Sí perché penso che faccia parte di noi e lo ritengo importante quanto l'Italiano.,Io Penso che si potrebbe usare in tutte le circostanze visto che lo ritengo uguale all'Italiano e non grezzo. ,Sí per dare la possibilità ai ragazzi di studiarne le origini e capire che é una lingua proprio come l'Italiano. Anche per tenerlo vivo e perché é sempre meglio insegnare piú lungue possibili.," Della zona, Penso che sia piú giusto. Cosí tutti hanno peso uguale. ","Sí con l'Italiano, per far capire che non é una lingua da escludere dai luoghi professionali. ",Non ho preferenze,,Italiana,Ritengo che persone montanare la maggior parte delle volte siano chiuse di mente con idee sbagliate., Magari delle volte penso che siano persone piú altezzose.,,4,1,1,1,1,3,4,1,"Al let, non sono sicura",El sol? Non lo so ,Al ment?,.... mia accort? ,Non lo so,Al rosch le le da la porta?,Non lo so,Non lo so
616857-616848-62394835,Femminile,,44,Primarie/Medie,Cuoca,Vignola ,Zocca ,44,No,,Italiano,Italiano,Italiano,Italiano,Molto bene,,Molto bene,,,"Sí,F",,"Sí,M,F",,"Sí,M,F",,"Sí,M,F",,"Sí,M,F",,,,,,"Sí,M",,"Sí,M,F",,"Sí,M,F",,"Sí,M,F",,,,"Sí,M",,"Sí,M,F",,,Sí,,Sí,,Sí,Alimentari ,Sí,,No,,Sí,,Sí,,Sí,,Sí,,,Sí,,Sí,,Sí,,Sí,,Sí,,Sí,,No,,Sí,,"Sí,No",,Sí,,"Sí,No",,Sí,,Sí,,Sí,,Molto spesso,,Molto spesso,,Mai,,,Sí,,,Sí,,,Sí,,,Sí,,,Sí,,,Sí,,,Sí,,,Sí,,,Sí,,,Sí,,,Sí,,,Sí,,,Sí,,,,Ogni giorno,,Ogni giorno,,Ogni giorno,,Si,Emiliano,Si,Tutti,Dappertutto ,Si,Emiliano romagnolo,Si...perché è una lingua pura,,,Emiliana,Abitare in montagna ,In paese,,1,1,2,1,1,1,2,1,Iet...,Al sol...,Al ment....è uguale ,Uguale ,a son arrivà molt student....,Al Pattom le accant a la port...,Uguale ,A me ha graffià le gat 
616857-616848-62399981,Maschile,,30,Secondarie Superiori,Disoccupato,Bologna ,Anzola dell'Emilia ,Un anno,No,,Italiano e inglese,Madre,Inglese dalla scuola media,Italiano ,50/50,Bolognese ,50/50,Bolognese,,"Sí,F",Il dialetto bolognese è  parlato molto bene dalla mia bisnonna di 95 anni.,"No,Altro",Tra ragazzi usiamo solo qualche breve frase sporadicamente in dialetto,"Sí,Altro",I vicini hanno un accento marcato e quelli sopra i 65 anni parlano abitualmente in dialetto,"No,Altro",Poco usuale parlare in dialetto tra 30 enni lo si fa solo per battute in modo scherzoso,"No,Altro",,,,,,,,"Sí,Altro","Nel tessuto emiliano il dialetto e sempre meno utilizzato, specialmente nelle zone di grandi città, complice l'alto numero di migranti di altri paesi e il bassissimo numero di nuove nascite di bolognesi","No,Altro",La maggior parte dei colleghi nel mio ultimo lavoro erano meridionali e parlavano il loro dialetto,No,,,,,,,,,Sí,,Sí,,No,,No,,No,,No,,No,,No,,Sí,"Luoghi montani, campagna o piccoli borghi ",,Sí,,No,,No,,Sí,Solo alcune espressioni quando parlo con i miei nonni,No,,No,,No,,Sí,,Sí,Rare volte capita di usare il dialetto ,No,,No,,No,,No,,Sí,"Per esprimere stupore e spesso usato il termine volgare ""soccia"" che in realtà è usato come esclamazione per evidenziare qualcosa che ci e sembrato insolito sia in senso positivo che negativo ",50/50,,50/50,A tal deg = a te lo dico  Brut quel = brutta storia    ,50/50,Inglese,Nessuno in particolare ,No,,,No,No,,No,No,,No,No,,No,No,,No,No,,No,No,,No,No,,No,No,,No,No,,No,No,,No,No,,No,No,,,Mai,,Ogni mese,"Radio italia credo che trasmetta ad una certa ora in dialetto, mi capita di ascoltarla raramente ",Mai,,Non mi dispiace ma non essendo una lingua particolarmente utile nella vita me me sono sempre interessato poco,Italiano,Non credo perché le nostre città stanno mutando culturalmente e questo non aiuterà il tramandare del dialetto locale,Forse insegnandogli a scuola si potrebbe creare un indotto per far rinascere la lingua,Penso nel tempo libero e nei luoghi poco formali,Solo nella città di appartenenza del dialetto,Ogni città il suo dialetto,Sarebbe carino da un punto di vista culturale ma non molto utile nella società moderna,Bolognese,,Bolognese,Aver vissuto in montagna,Vivere in città ,,3,3,3,1,1,3,4,1,Me vag a let = io vado a letto,Sol,Non saprei,Agne brisa acort ancion = non se ne accorto nessuno (so pronunciarlo ma scriverlo e difficile),Gne arvé  di mondi ad studant ieri,Il Rusco lè attachè al purton,Agnè piò = non ci sono più ,Ah mà sgraffe el gat 
616857-616848-62398471,Femminile,,36,Laurea Triennale,Operaio ,Giappone,Zocca,8anni in italia,No,,Italiano,Giapponese da i genitori,Inglese e italiano a scuola,Giapponese,Per niente,,Per niente,,,,,,,,,,,,,,,,,,,,,,,,,,,,,,,,,,,,,,,,,,,,,,,,,,,,,,,,,,,,,,,,,,,,,,,,,,,,,,,,,Mai,,Alle volte,Inglese,,No,,,,,,,,,,,,,,,,,,,,,,,,,,,,,,,,,,,,,,,,Mai,,Mai,,Mai,,Mi piacerebbe perché è una parte della cultura italiana. Sarebbe triste se un giorno nessuno sapesse parlarla/capirla... ,Italiano perché vive in Italia. Poi anche giapponese perché io  vengo da Giappone.,Si. Il motivo è scritto alla questione n23,Insegnare a scuola insieme alla cultura italiana. Oppure a una sorta di workshop/lezione culturale per gli adulti...,"Quando vuole, dove vuole ma con chi capisce.  ","A scuola, sì. Perché ripeto ma è una parte della cultura. ",Livello elementare. Cioè quelle parlate spesso.,No. Perché se non c'è occasione di parlarlo dopo non ha senso di imparare bene.   ,,,Giapponese,Chi vive in montagna,Non lo so....,,2,2,3,2,3,3,3,3,,,,,,,,
