616857-616848-63523808,Femminile,,21,Secondarie Superiori,Studentessa ,Modena,Modena ,21 anni,No,,Italiano,Italiano (tutti),"Inglese (scuola elementare, media, superiore), francese (scuola media)",Italiano entrambi ,Un po',Modenese ,Un po',Modenese ,,"Sí,M,F","In famiglia lo parlavano le bisnonne che ho conosciuto, un po' il nonno materno e poi solo altri parenti più lontani",No,,No,,No,,No,,"Sí,M","Raramente, ma ci capita di parlare di termini del dialetto... soprattutto confrontando tra modenese/reggiano",No,,"Sí,M","Molto poco, solo alcune parole o modi di dire inserite in frasi in italiano","Sí,F",La nonna del mio moroso,No,,Sí,,No,,No,,No,,,Sí,,No,,No,,No,,No,,No,,Sí,Le persone più anziane,No,,No,,,Sí,,No,,No,,No,,No,,No,,No,,Sí,,Sí,,No,,Sí,,No,,No,,No,,Molto spesso,,Alle volte,,Alle volte,Inglese,,No,,,No,No,,No,No,,No,No,,No,No,,No,No,,No,No,,No,No,,No,No,,Sí,No,,No,No,,Sí,No,Instagram ,No,No,,,Mai,,Mai,,Mai,,"Non mi piace molto e non mi interessa neanche troppo, la considero una lingua morta","Italiano, inglese perché una è la mia prima lingua e l'altra serve molto a scuola e nella vita in generale",Non credo perché preferisco conoscere e usare lingue con cui posso rivolgermi a più persone possibile indipendentemente dalla provenienza,"Si potrebbe far vedere documentari ai ragazzi a scuola nell'ambito dell'apprendimento della storia locale, come cultura generale",Non credo ci siano ambiti in cui si dovrebbe usarlo,"No, non credo",Non credo andrebbe insegnato,"No, non credo",,"No, perché tra le seconde lingue meglio quelle straniere a mio parere",Italiana,Venire dalla montagna ,Venire dalle città di pianura,,4,3,3,3,3,3,4,2,Al Lèt,Al Sòl,,,,,,
616857-616848-63523917,Femminile,,24,Migistrale e oltre,studente,Carpi,Carpi,24 anni,No,,italiano ,italiano ,francese e inglese a scuola,italiano ,Molto bene,modenese,Un po',Modenese,,"Sí,M,F",,"Sí,M,F",,No,,"Sí,F",,No,,No,,No,,No,,"Sí,M,F",,No,,No,,No,,No,,M,,,No,,No,,No,,No,,No,,No,,No,,No,,No,,,Sí,,No,,No,,No,,No,,No,,Sí,,Sí,,Sí,,Sí,,Sí,,No,,No,,No,,Molto spesso,,Alle volte,,Alle volte,Inglese francese latino,,No,,,,,,,,,,,,,,,,,,,,,,,,,,,,,,,,,,,,,,,,Mai,,Mai,,Mai,,"non lo parlo perché non mi viene spontaneo, non perché non ne sarei capace",italiano e termini in emiliano,"certo, è un retaggio ",genitori e conoscenze ,situazioni informali e amichevoli ,no assolutamente. È una lingua povera ed esclusivamente parlata. Le trascrizioni sono venute molto dopo e spesso sono approssimative e inesatte. ,non andrebbe insegnato. ,"Assolutamente no, le scuole devono mantenere l'italiano per unificare il territorio ",non si può esprimere un giudizio di valore. Ciascuna varietà dipende dalla zona di appartenenza. Sarebbe stupido e insensato prediligere una sola,non credo che si possa fare questo discorso anche col dialetto,italiana,Abitare in montagna. Solitamente è gente più conservatrice e cocciuta ,Essere più progressisti e innovativi ,,4,3,3,2,3,3,3,2,al lët,al sœl,al mint,Le lor an ni son gnanca acort,Son arrivée dimondi studint ier,al rusc l'è cat à la porta,a gni son più catein dan la tavla,m'ha sgiafré al gat  M'ha sgiafrée la gatä
616857-616848-63523957,Maschile,,21,Secondarie Superiori,Studente universitario,Modena,Modena ,21 anni,No,,Italiano ,Italiano da padre e madre,Inglese tramite istruzione scolastica e corsi,Italiano,50/50,Modenese,50/50,Modenese,,Sí,,Sí,,No,,Sí,,No,,No,,No,,Sí,,Sí,,Sí,,No,,No,,No,,No,,,Sí,,No,,No,,Sí,,No,,No,,No,,,,No,,,Sí,,No,,No,,Sí,,Sí,,No,,No,,Sí,,Sí,,Sí,,No,,Sí,,No,,No,,Spesso,,50/50,,50/50,Inglese ,,No,,,,,,,,,,,,,,,,,,,,,,,,,,,,,,,,,,,,,,,,Mai,,Mai,,Mai,,Si mi piace parlare emiliano e vorrei impararlo meglio,Cercherei di insegnarli tutte le lingue che conosco,"Si fa parte della tradizione e della storia di questo territorio, collega le vecchie generazioni con le nuove",Credo sia una tradizione che debba essere tramandata dalla famiglia,Dove ognuno crede sia giusto usarlo,"Credo che debba essere preservato più che insegnato , bisogna apprezzarlo",Non conosco altre varietà di  emiliano oltre al modenese,"Al giorno d'oggi penso che non sia una lingua di facile comprensione per tutti i partecipanti delle scuole  e delle università,  quindi penso di no ",,Pensavo già queste cose quindi non mi fa riconsiderare il valore dell'emiliano ,Emiliano ed Italiano,Essere montanaro per me vuol dire essere una persona che ama e apprezza la vita di montagna,Una persona che si trova a suo agio nel vivere nel ritmo delle città della pianura padana,,2,3,3,2,3,3,3,2,Let,Sol,,An sun menga acort,,,,
616857-616848-63523429,Maschile,,19,Secondarie Superiori,Studente,Perugia,Bologna,16 anni,No,,Italiano,Bolognese dagli zii,No,"Mia madre parla poco bolognese, mio padre spesso usa termini perugini ma non stretti",Bene,Bolognese,50/50,Bolognese,,"Sí,M,F",,No,,No,,No,,No,,No,,No,,No,,No,,No,,No,,No,,No,,No,,,No,,No,,No,,No,,No,,No,,No,,No,,No,,,Sí,,No,,No,,Sí,,Sí,,Sí,,No,,Sí,,No,,No,,Sí,,No,,No,,No,,Molto spesso,,Spesso,,Spesso,,,No,,,,,,,,,,,,,,,,,,,,,,,,,,,,,,,,,,,,,,,,Mai,,Mai,,Mai,,Vorrei parlarlo molto meglio di come faccio,Tutte quelle possibili,"Sì, perché racconta la storia della regione",Se c'è qualche professore più anziano potrebbe fare dei corsi pomeridiani a scuola ma comunque bisognerebbe parlarlo fuori sennò si andrebbe comunque a perdere,Prima di tutto in famiglia,Sì,"Ognuna in ogni zona in cui è parlato, cioè magari andrebbero codificate meglio perché può anche variare di paesino in paesino",No perché rischierebbe di portare incomprensione sui programmi scolastici tra regioni diverse,Il bolognese ma perché abito qui e i vecchietti di borgo panigale fanno spisciare e dovrebbero essere tutelati,"Sì anche se bisogna dirgli che sono lingue diverse, io da bambino mi sono ritrovato a Perugia a chiedere un cucharên o dove buttare il rusco e non sapevano di cosa parlassi","Perugino, anche se forse sono molto più bolognese",I montanari sono coloro che vivono negli appennini e spesso scendono il città a lavorare/studiare,"Il cittadino è colui che vive in città, spesso parla meno l'emiliano rispetto al montanaro",,3,3,3,1,2,3,4,1,Al lèt,Sàul,,L'an brisa vest,Al son arive un mucchio de scholer,Il rusc è in vatta a l'usc,In vatta a la tavla gne piò dle catine,
616857-616848-63524122,Femminile,,18,Primarie/Medie,Studente,Reggio Emilia,Rubiera,18 anni,No,,Italiano ,Italiano da mia madre ,Inglese da maestre e professori,Italiano,50/50,Reggiano,Un po',Reggiano,,"Sí,M,F",,"Sí,M",,No,,"Sí,M",,No,,No,,No,,"Sí,M",,No,,No,,"Sí,M,F",,No,,No,,No,,,No,,No,,No,,Sí,,No,,No,,No,,No,,Sí,,,Sí,,No,,No,,Sí,,Sí,,No,,No,,Sí,,Sí,,No,,Sí,,No,,No,,No,,Molto spesso,Vado a ca',Molto spesso,Vado a ca',Spesso,"Inglese, francese, spagnolo",Vado a prendere una Apple ,No,,,,,,,,,,,,,,,,,,,,,,,,,,,,,,,,,,,,,,,,Mai,,Mai,,Mai,,Mi piace perchè mi fa stare bene quando provo emozioni forti,Italiano perché è la principale che si usa per comunicare in Italia. Un pugliese non capirebbe il dialetto reggiano.,Si per tradizione,Creare una cultura tra gli adolescenti in modo tale che inizino ad usarlo anche loro. I nonni fanno la loro parte.,Per parlare con amici scherzando.,"No, non è una lingua nazionale o mondiale.",Vedi sopra.,"No, non è una lingua ufficiale.",Beh tra Modena e Reggio non cambia molto. Poi non so per le altre città.,"No, ci sono cose molto più importanti da sapere. Tipo l'inglese se parliamo in ambito linguistico",Italiana e in secondo luogo reggiana.,Uno che abita in montagna oppure uno a cui piace fare passeggiate e ammirare la natura in montagna.,Abitare in una città e quindi essere considerato un cittadino di quel paese.,,3,3,3,3,3,3,2,4,Let,Saul,Non lo so ,Ag Nian badè,Non lo so,Non lo so ,An ghe son mia bacineli sulla tevla, M'ha sgrafigne al gat  M'ha sgrafigne la gata
616857-616848-63525254,Femminile,,1,Laurea Triennale,20,Modena,Modena,Sempre,No,,Italiano,Italiano ,Inglese  a scuola,Italiano,Molto bene,,Bene,,,Sí,,Sí,,Altro,,Sí,,No,,No,,No,,Sí,,No,,No,,Sí,,No,,No,,No,,,Sí,,Sí,,No,,No,,No,,No,,No,,No,,No,,,Sí,,Sí,,No,,Sí,,Sí,,Sí,,No,,Sí,,Sí,,No,,Sí,,No,,No,,No,,Spesso,,Alle volte,,Mai,,,No,,,,,,,,,,,,,,,,,,,,,,,,,,,,,,,,,,,,,,,,Mai,,Mai,,Mai,,Mi piace ,Italiano e un pò Emiliano ,Sono le nostre origini,Non so ,In famiglia ,Si come ogni lingua ,. ,Non credo,,Si,Emiliano ,Essere nato in montagna ,Vivere in pianura ,,2,1,4,1,1,1,1,1,Let,,,,,,,
616857-616848-63523763,Femminile,,20,Secondarie Superiori,Studentessa,Carpi,Soliera,20 anni,Sí,Carpi-Bologna,Italiano e dialetto modenese/mantovano,Italiano dai genitori,Dialetto dalla nonna materna,Italiano ,Bene,Modenese/mantovano,50/50,Modenese/mantovano,,"Sí,M,F",,"Sí,M,F",,,,"Sí,M,F",,No,,No,,No,,No,,No,,No,,Sí,,No,,No,,No,,,No,,No,,No,,No,,No,,No,,Sí,,No,,No,,,No,,No,,Sí,,No,,Sí,,No,,Sí,,Sí,,Sí,,Sí,,No,,No,,No,,No,,50/50,,Alle volte,,Alle volte,Inglese,,No,,,,,,,,,,,,,,,,,,,,,,,,,,,,,,,,,,,,,,,,Mai,,Mai,,Mai,,Si mi piace perché mi fa sentire più vicino ai miei nonni e alla tradizione,Italiano,Sì ,Credo sia inevitabile che vada perso,Contesto familiari e popolari,"No, forse alle scuole elementari si potrebbe valorizzare con qualche esperienza formativa in più alle lezioni ordinarie",Non lo so,No,,Forse sarebbe più utile insegnare l’inglese rispetto all’Emiliano anche se sarebbe bello tramandare la tradizione,Italiano ,Abitare in montagna,Abitare in pianura,,3,4,3,5,4,3,2,4,Al let,Al sol,Non lo so,A son mia vist brisa ,Non lo so,Al rusc le visin a la porta,Ag son mia al bacineli su la tavla ,Non lo so
616857-616848-63525450,Femminile,,23,Secondarie Superiori,Studente ,Cento (FE),Crevalcore (BO),23 anni,No,,Italiano,.,.,Italiano,Bene,Modenese e Bolognese,Un po',,,"Sí,M,F",,"Sí,M,F",,"Sí,M,F",,Sí,,No,,No,,No,,No,,No,,No,,No,,No,,No,,No,,,Sí,,Sí,,Sí,"Supermercato, fruttivendolo, macelleria",Sí,,No,,No,,No,,No,,No,,,Sí,,"Sí,No",,No,,No,,Sí,,No,,No,,Sí,,Sí,,Sí,,Sí,,No,,No,,No,,Spesso,,Alle volte,Rusco,Alle volte,Inglese,,No,,,,,,,,,,,,,,,,,,,,,,,,,,,,,,,,,,,,,,,,,,,,,,Mi piacerebbe parlarlo meglio,Italiano,Non credo sia utile mantenerlo ma resta un pezzo di storia,Istruzioni ad hoc ,Tra amici e in contesti informali,"No, non credo debba essere studiato obbligatoriamente, ma chi vuole dovrebbe poterlo imparare",Tutte,No non lo penso,,Credo ci siano lunge più importanti da far imparare ai bambini ,Emiliana,Venire dalle montagne,Abitare in pianura,,3,3,3,2,2,3,4,2,,,,,,,,
616857-616848-63525319,Femminile,,23,Secondarie Superiori,Studentessa,Sassuolo,Fiorano modenese,Da sempre,Sí,Sassuolo - parma,Italiano ,Italiano,Italiano,Italiano,Bene,,Un po',,,"Sí,F",,"Sí,F",,"No,Altro",,"Sí,F",,"No,Altro",,"Sí,F",,"No,Altro",,"Sí,M",,"No,Altro",,"No,Altro",,"No,Altro",,"No,Altro",,"No,Altro",,,,,No,,No,,No,,Sí,,Sí,,No,,No,,No,,,,,No,,No,,No,,Sí,,Sí,,No,,No,,Sí,,No,,No,,Sí,,No,,No,,,,Spesso,,Alle volte,,Alle volte,Inglese,,No,,,,,,,,,,,,,,,,,,,,,,,,,,,,,,,,,,,,,,,,Mai,,Mai,,Mai,,Mi piacerebbe poterlo parlare di più ,"Italiano, e qualche espressione emiliana",Si è una tradizione,"In famiglia, i nonni sono quelli che più ne conoscono","Non c’è un momento preciso, quando capita",No è un po’ eccessivo,"Modenese, sono di parte",No,,No perché si parla in poche aree,Emiliano,"Provenire dalla “montagna” e avere modi di fare e dire diversi, quasi più grezzo ma alla mano",Essere diversi da un montanaro,,3,2,5,2,4,4,4,2,Al let,Sol,Meint,An mi son menga acòrta,Ier a son gnudi tant studenti,L’è vsein alla porta,,Al ma grafie cal gat lè
616857-616848-63524497,Maschile,,17,Primarie/Medie,Studente - in estate barista,Carpi,Montefiorino,Sempre,Sí,Montefiorino-Sassuolo,Italiano   Inglese  Francese   Tedesco  Spagnolo   Dialetto,"Nonni, genitori  ","Spagnolo, me",Inglese francese tedesco italiano,Molto bene,"Il dialetto di Montefiorino, diverso dal frignanese e dal sassolese",Molto bene,Montefiorinese,,"Sí,M,F",,"Sí,M,F",,"Sí,M,F",,"Sí,M,F",,No,,No,,No,,"Sí,M,F",,"Sí,M,F",,"Sí,M,F",,"Sí,M,F",,No,,No,,"Sí,M,F",,,Sí,,Sí,,Sí,In quelli del paese,Sí,Con i compagni ,No,,Sí,,No,,No,,No,,,Sí,,No,,No,,Sí,,Sí,,Sí,,Sí,,Sí,,Sí,,Sí,,Sí,,Sí,,,,No,,Molto spesso,"Ciao, grazie, nomi di alcune città..",Molto spesso,"A tal degli, vola bas...",Molto spesso,"Inglese di solito, anche francese e spagnolo","In inglese frasi comuni, in spagnolo e francese alcune parole",Sí,Montefiorino,,Sí,No,,No,No,,Sí,No,,Sí,No,,Sí,No,,No,No,,Sí,Sí,,Sí,Sí,,No,No,,Sí,Sí,,Sí,Sí,,No,No,,,Ogni settimana,,Ogni settimana,,Ogni giorno,,"Mi piace molto, in quanto è la lingua della mia famiglia (essendo originaria di Montefiorino e Frassinoro), delle mie origini e delle mie radici ","Italiano, Dialetto (per le ragioni sopra indicate), inglese (è la lingua che si parla in tutto il mondo), spagnolo (ha miliardi di persone che lo parlano)","Si, ha una storia e va conservata. Ci riguarda da vicino e ha una pronuncia, una cadenza e un lessico unico che non va perso.","Insegnarlo, aprire pages che riguardano il territorio con meme, parole e detti, non mischiato ad altre culture ad esso straniero...","Tra amici, in paese perché è la lingua delle nostre zone","Perché è la nostra storia, va conservata e portata avanti","Il modenese o il sassolese, anche se i vari dialetti dei paesi montanari (ognuno ha il suo ben distinto), andrebbero insegnati","Non come lingua ufficiale, perché si perderebbe il ""filo"" dell'italiano, ma come ora di dialetto si, perché è cultura e storia","Montefiorinese, è quello del mio paese. Credo che il sassolese e il modenese siano quelli con la pronuncia più orecchiabile ","Si, oltre alla cultura e alla storia, se porta anche vantaggi ancora meglio","Montefiorino (MO), Emilia Romagna.","Io, che viene da un paese di montagna tipo Montefiorino. Anche se a volte lo usiamo per dire arretrato (quelli di frassinoro)","Un pianzano è uno che viene su d'estate e (un po' meno dei milanesi) crede di essere il capo, il padrone di tutto ahaha. Uno che abita in città: a castellarano sassuolo modena Fiorano maranello milano ecc",,1,1,1,1,1,1,1,1,E let,E sul,"E ment, oppure la guina, appena sotto al mento",An sin sun mia adædi,"Er, ien arivædi na mœchia ed student",E rœsk l'è vsin a l'œs,Ang sun po al bacineli incema alla tavla,E m'à sgrafignæ e gat/la gata
616857-616848-63525079,Femminile,,20,Secondarie Superiori,Studente,Carpi,Modena,20 anni,Sí,Modena - Reggio Emilia,Italiano,Italiano dai miei genitori,Inglese scuola,Italiano,Bene,Modenese,Un po',Modenese,,"Sí,M,F",,"Sí,M",,No,,No,,No,,"Sí,F",,No,,"Sí,M",,No,,No,,"Sí,M,F",,No,,No,,,,,No,,Sí,,No,,No,,No,,No,,No,,No,,,,,Sí,,No,,Sí,,No,,Sí,,No,,No,,Sí,,Sí,,No,,Sí,,No,,No,,,,Molto spesso,,Molto spesso,,Alle volte,,,No,,,,,,,,,,,,,,,,,,,,,,,,,,,,,,,,,,,,,,,,Mai,,Mai,,Mai,,"Mi piacerebbe conoscerlo meglio perché è la lingua della mia tradizione e come ogni lingua porta avanti una sua cultura, modi di dire e termini particolari. È un peccato perderla.",Italiano perché l'altra lingua che so è l'inglese ma con i compagni di scuola non lo parlerebbero,Sì per i motivi alla risposta 23,"Dovrebbe essere portato avanti da chi lo ha imparato nella vita di tutti i giorni, non è una lingua che va insegnata ma tramandata (secondo me), ma non saprei in che modo","Nei momenti di svago, in famiglia o tra amici, non in momenti dove serve serietà come uffici o scuola",No perché va vissuta e non imparata dietro ad un banco di scuola,Ognuno dovrebbe portare avanti ciò che conosce,"No, a causa della varietà l'italiano serve per unirci come Italia",Modenese perché lo capisco già,Lo sapevo già infatti invidio chi è cresciuto parlando italiano e dialetto,Italiana,Abitare in montagna e respirare meno inquinamento di noi della bassa,Il contrario della risposta 34,,3,3,3,1,1,2,4,1,,,,,,,,
616857-616848-63524867,Femminile,,24,Laurea Triennale,Studentessa,Vignola (MO) ,Maranello (MO),"Dalla nascita, 24 anni",Sí,Maranello - parma ,Italiano,Italiano dai genitori,Nessun’altra ,Italiano ,Un po',Dialetto modenese,Un po',Dialetto modenese,,Sí,,Sí,,No,,No,,No,,Sí,,No,,No,,No,,No,,No,,No,,No,,No,,,Sí,,No,,No,,Sí,,Sí,,No,,No,,No,,,,,Sí,,No,,No,,No,,Sí,,Sí,,No,,Sí,,Sí,,No,,Sí,,No,,No,,,,50/50,,50/50,,Alle volte,Inglese,,No,,,,,,,,,,,,,,,,,,,,,,,,,,,,,,,,,,,,,,,,Mai,,Mai,,Mai,,Si e mi piacerebbe saperlo parlare meglio. Fa parte della tradizione e purtroppo sì sta perdendo. Gli unici che lo sanno ancora bene e lo parlano spesso sono i nonni ,Italiano e inglese.   Se lo sapessi bene anche modenese,"È una parte importantissima della nostra tradizione, perderlo sarebbe un peccato. ","Sicuramente parlarlo e tramandarlo in famiglia, o anche organizzare corsi da parte del comune ",In qualsiasi conversazione non formale,No ,Ogni città ha il proprio dialetto e chiaramente bisognerebbe imparare quello della città in cui si nasce e cresce,"No. Il dialetto è una lingua che fa parte dell’identità popolare, non trovo giusto imporla a livello di istruzione ",Ognuno la propria ,"L Emiliano è una cosa in più, non fa parte delle lingue standard che sono utili nel futuro dei bambini, è giusto conoscerlo ma non lo potranno parlare con chiunque come le altre lingue, bensì con le persone che sono cresciute nella medesima zona .   Non ritengo che questa lingua possa portare ai benefici sopra descritti ",Domanda poco chiara,Essere cresciuto in montagna ,"Ritengo i due termini differenti tra loro. Cittadino colui che abita in città, pianeggiante in pianura ma in periferia ",,3,3,3,2,3,3,4,1,,,,,,,,
616857-616848-63525416,Maschile,,23,Secondarie Superiori,Assistente direttore di Cantiere,Modena,Modena,23,No,,Italiano,Italiano,Italiano,Italiano,Bene,Modenese,50/50,Modenese,,Sí,Solo anziani,Sí,,No,,No,,No,,No,,No,,No,,No,,Sí,,No,,No,,No,,No,,,Sí,,Sí,,Sí,,No,,No,,Sí,,No,,No,,No,,,Sí,,Sí,,No,,No,,Sí,,No,,No,,Sí,,Sí,,Sí,,Sí,,Sí,,No,,No,,Molto spesso,,"Spesso,50/50",,Alle volte,Inglese ,Weekend ,No,,,,,,,,,,,,,,,,,,,,,,,,,,,,,,,,,,,,,,,,Mai,,Mai,,Mai,,Si,Italiano,Si,Insegnamento a scuola,Momenti informali ,Si,Regionale ,No,,"No, non può essere considerata una lingua ",Italiano ,"Al Móntaner , beve e guida male ","Al piâzan, troppe varietà, impossibile definirlo ",,3,3,3,2,2,1,4,2,Al let,Sol,,,A sûn arrivè di mondi studeint ier,Al rusc l'é de drē a L'os,,Al gat al ma grafie 
616857-616848-63525623,Maschile,,19,Secondarie Superiori,Studente ,Carpi (MO),Soliera (MO),19 anni,No,,Italiano,"Italiano, da madre e padre","Dialetto modenese, dai nonni  Francese, Inglese, Latino a scuola","Francese, Inglese, Italiano ",Molto bene,Modenese,Molto bene,Modenese,,"Sí,M,F",,"Sí,M,F",,No,,"Sí,M",,No,,"Sí,M,F",,No,,"Sí,F",,"Sí,M,F",,No,,"Sí,M,F",,No,,No,,,,,Sí,,Sí,,No,,Sí,,Sí,,No,,No,,No,,,,,Sí,,No,,No,,Sí,,Sí,,Sí,,Sí,,Sí,,Sí,,Sí,,Sí,,No,,No,,,,Spesso,,Molto spesso,,Alle volte,"Inglese, Francese, Latino",,Sí,Modenese,,No,No,,No,No,,Sí,No,Siti internet,No,No,,No,No,,No,No,,Sí,Sí,,No,No,,No,No,,Sí,Sí,,No,No,,,,,,Ogni mese,Mo pensa te su Trc,Mai,,Ogni settimana,Youtube ,Moltissimo ,Italiano e emiliano per non perdere le tradizioni ,"Sì, perché é uno dei simboli della nostra terra",Bisognerebbe lavorare di più con i social media,In piccole dosi in ogni occasione ,"No, va imparato parlando con i familiari ","Tutte, dipende dalla zona geografica di nascita","No, perché è una lingua troppo contadina",Modenese perché è la variante della mia città ,Sì perché il bambino inizia fin da subito a relazionarsi con più lingue,Emiliano,Abitare in montagna ed essere una persona grezza a tratti ,Abitare in pianura ed essere una persona ordinaria ,,4,3,3,1,2,3,5,1,Al let,Al sol,Al meint,In g'han gnanc dèe a meint ,I'in arivèe dimondi studeint aièr,Al rôsc l'è dfianc a la porta,In ghin piô al bacineli insema a la tevla,Al gat al m'ha grafièe
616857-616848-63525720,Femminile,,20,Secondarie Superiori,Studente ,Modena,Maranello,20 anni,Sí,Maranello-Torino,Italiano,Italiano - parenti,"Inglese, francese, spagnolo, tedesco - scuola",Italiano,Bene,Modenese ,Un po',Modenese,,"Sí,M,F",,"Sí,M,F",,"No,M,F",,"No,M,F",,"No,M,F",,"No,M,F",,"No,M,F",,"No,M,F",,"No,M,F",,"No,M,F",,"No,M,F",,"No,M,F",,"No,M,F",,"No,M,F",,,No,,No,,No,,No,,No,,No,,No,,No,,Sí,Casa,,Sí,,No,,No,,No,,Sí,,No,,No,,Sí,,Sí,,Sí,,Sí,,No,,No,,No,,Molto spesso,,Spesso,,Spesso,"Inglese, francese, tedesco, spagnolo",,Sí,Modenese,,No,,,No,,,No,,,No,,,No,,,No,,,No,,,No,,,No,,,No,,,Sí,,"Pagine Instagram, facebook",No,,,,Mai,,Mai,,Ogni anno,,"Si, vorrei approfondire la conoscenza dell’emiliano poiché la considero una ricchezza che altresì verrebbe persa, se non tramandata","Italiano, non conosco abbastanza bene l’emiliano","Si, è una ricchezza del territorio che se non tramandata oralmente verrà persa con il tempo","In primis le famiglie dovrebbero parlarlo e farlo imparare alle nuove generazioni, senza denigrarlo","In casa soprattutto, ma anche in altri contesti tipo in negozi","Solo come corso di approfondimento, l’istruzione principale dovrebbe venire dalle famiglie del luogo","Tutte le varietà, ognuna nel suo luogo di provenienza","No, è comunque importante mantenere l’italiano come lingua principale in quanto permette di comunicare chiaramente con tutto il paese, soprattutto in contesti formali",,"Certamente, è essenziale come l’apprendimento di altre lingue quali l’inglese",Emiliana/italiana,"Avere una mentalità più chiusa per certi aspetti e conformarsi ad un sentire comune della zona, ma anche vivere la vita in semplicità e con meno pensieri","Cercare di raggiungere standard dettati dall’alto, in diversi ambiti e aspetti, arrivando talvolta a perdere contatto con il proprio territorio e le proprie tradizioni",,3,3,3,2,3,3,4,1,,,,,,,,
616857-616848-63523650,Femminile,,53,Secondarie Superiori,Casalinga,Sassuolo MO,PAVULLO nel frignano MO,30 anni,No,,Italiano  Francese saltuariamente,Italiano e dialetto fioranese in famiglia ( mamma e papà poi a scuola),Inglese e francese a scuola poi dialetto pavullese dopo sposata,Italiano e parlata lucchese (mamma)  Italiano e dialetto fioranese (papà),Molto bene,Modenese e bolognese,Un po',Dialetto fioranese con influenze pavullesi ,,Sí,,Sí,,,,,,,,,,,,Sí,,Sí,,,,Sí,,,,,,,,,Sí,,Sí,,,,,,,,,,,,,,Sí,Quando mi trovo in compagnia di parenti e amici,,Sí,,,,,,Sí,,Sí,,,,,,Sí,,,,,,Sí,,,,,,,,Alle volte,Quando non mi ricordo la parola in dialetto,Alle volte,Quando voglio scherzare o sono insieme ad amici o parenti,Alle volte,Francese e inglese,Francesismi e inglesismi,Sí,Dialetto fioranese con inflessioni di pavullese,,Sí,,,,,,,,,,,,,,,,,,Sí,Sí,,,,,Sí,Sí,Sono iscritta ad un gruppo che si chiama “ Chè as ciacara in dialét” per divertirmi e ripassare il dialetto,Sí,Sí,,,,,,,,,,,,,Ogni giorno,,"Sì mi piace, mi riporta indietro alla mia infanzia perché mio padre parlava quasi sempre in dialetto e anche perché identifica le mie origini e mi sento di appartenere al territorio dove vivo",Con loro parlo in italiano e loro purtroppo faticano sia a capirlo che a parlarlo,"Sì perché è la nostra lingua locale e ci identifica, purtroppo però le nuove generazioni non la parlano molto. ",Dovremmo farlo in famiglia però succede che la gente al giorno d’oggi si sposta molto e spesso i genitori sono di origini diverse per cui si finisce per parlare l’italiano. Però se anche a scuola si facesse non sarebbe male...,In famiglia e con gli amici perché è più semplice ma spesso al giorno d’oggi gli amici sono di varie culture e origini quindi diventa difficile anche quello. Per questo motivo mi sono iscritta a questo gruppo fb dove posso trovare persone con cui comunicare. ,A scuola si potrebbe fare nella scuola primaria e secondaria in modo facoltativo. All’università sarebbe interessante integrare con qualche esame o lezioni di dialetto locale nelle facoltà umanistiche. Almeno per lasciare traccia a livello culturale,In ogni zona il proprio dialetto ,Si potrebbe insegnarlo a chi interessa per lasciare traccia delle proprie origini e cultura,Credo che a ognuno ognuno piaccia il proprio dialetto del proprio paese. A Modena però si potrebbe insegnare il Modenese cittadino che è comprensibile a molti credo. ,Certo. Sapere l’emiliano è come sapere un’altra lingua. Però purtroppo spesso si pensa che possa interferire con l’apprendimento dell’italiano corretto e in casa non viene parlato,Italiana e nello specifico emiliana. Poi mi definisco anche tosco- emiliana perché mia mamma era originaria della provincia di Lucca ma dopo essersi sposata si è trasferita a Fiorano (Mo) con mio padre. ,Ecco poi adesso sono diventata montanara perché abito a PAVULLO da 30 anni. I montanari sono gli abitanti dell’Appennino,Vuol dire abitare in città o in pianura. Noi in montagna li chiamiamo “piangiani” e devo dire che io che vengo dalla pianura vengo anche definita “piangiana”,,3,3,3,1,3,3,5,1,Al let,Al saul,Al meint,In ne soun  gnanc accort,I soun arrivé tant studeint ier,Al rosch l’è avsein à la porta,In ghein menga piò al bacineli sovra la tavla,Al gat al m’a sgraffigné  La gata la m’a sgraffiné
